,name,ratings,no_of_ratings,discount_price,actual_price
0,"Supples Baby Pants Diapers, Medium (7-12 kg), 72 Count",4.0,127863.0,639.0,949.0
1,"Pampers Active Baby Taped Diapers, Medium size diapers, (6-11kg) 90 count,taped style custom fit",4.5,65629.0,1529.0,1699.0
2,"Mamaearth Hydragel Indian Sunscreen Spf 50, With Aloe Vera & Raspberry, For Sun Protection - 50G",4.0,4897.0,346.0,399.0
3,Mamaearth Gentle Cleansing Shampoo for Babies (200 ml),4.3,19845.0,152.0,199.0
4,"Himalaya Extra Moisturizing Baby Wash, 400 ml",4.3,6456.0,198.0,275.0
5,"MamyPoko Pants Extra Absorb NB76,Unisex Baby, Pack of 76 (Upto 5 Kg)",4.3,155343.0,649.0,999.0
6,"LuvLap Tiny Love Heat Sensitive Baby Feeding Spoons Set, Food Grade PP Kids & Baby Spoon with Soft Silicone Tip, Color cha...",4.4,5814.0,131.0,159.0
7,"Supples Baby Wet Wipes with Aloe Vera and Vitamin E, 72 Wipes/Pack, (Pack of 6)",4.4,59138.0,370.0,744.0
8,Philips Avent NATURAL 2.0 BOTTLE 260ml Single SCF033/10,4.5,6507.0,499.0,515.0
9,Mamaearth Tea Tree Natural Face Wash for Acne & Pimples Wash 100 ml - For Normal & Dry Skin,4.0,16718.0,240.0,259.0
10,"Pampers Premium Care Pants, Large size baby Diapers, (L) 88 Count,9-14 Kg, Softest ever Pampers Pants",4.5,4985.0,1702.0,2398.0
11,"MamyPoko Pants Extra Absorb NB114,Unisex Baby, Pack of 114",4.3,2054.0,929.0,1499.0
12,Mamaearth Daily Moisturizing Natural Baby Lotion (400 ml),4.3,12057.0,289.0,399.0
13,"Pampers Premium Care Pants, Medium size baby Diapers, (7-12kg) 108 Count Softest ever Pampers Pants, Medium Size, Pack of 108",4.5,5366.0,1715.0,2398.0
14,"Huggies Complete Comfort Wonder Pants, Medium (7-12kg) Size Count 100 Baby Diaper Pants Combo Pack of 2, 50 count Per Pac...",4.2,215914.0,1022.0,1398.0
15,"Pampers All round Protection Pants, Medium size baby Diapers, (7-12kg) 200 Count Lotion with Aloe Vera",4.3,3948.0,2186.0,3149.0
16,Pampers Baby Gentle Wet Wipes with Aloe Vera 144 Wipes,4.3,5035.0,229.0,498.0
17,Mamaearth Vitamin C Oil-Free Moisturizer For Face With Vitamin C & Gotu Kola For Skin Illumination - 80 Ml,4.1,3395.0,280.0,319.0
18,"Huggies Complete Comfort Wonder Pants Extra Large (XL) Size Baby Diaper Pants Sumo Pack, 168 count, with 5 in 1 Comfort",4.2,215914.0,2495.0,3899.0
19,"Nestle LACTOGEN 1 Infant Formula Powder - Upto 6 months, Stage 1, 400g Bag-in-Box Pack",4.4,6458.0,395.0,415.0
20,Mamaearth Onion Hair Oil For Hair Growth With Onion & Redensyl For Hair Fall Control - 250Ml,4.1,13553.0,508.0,599.0
21,"Pampers Premium Care Pants,New Born Extra Small size baby Diapers,(NB/XS)70 count,Upto 5 kg Softest ever Pampers",4.4,11056.0,767.0,1149.0
22,"MamyPoko Pants Extra Absorb XL42,Unisex Baby, Pack of 42 (12-17Kg)",4.3,155343.0,699.0,999.0
23,"Huggies Complete Comfort Wonder Pants,Large (L) Size Baby Diaper Pants,(64 count) (9-14Kg) with 5 in 1 Comfort",4.2,215914.0,881.0,1399.0
24,"Mamaearth Natural Repellent Mosquito Patches For Babies with 12 Hour Protection,White,Pack of 1",3.9,3169.0,152.0,199.0
25,"Kotex Overnight Period Panties (Medium/Large size, pack of 10 panties) for heavy flow period protection | with 360 degree ...",4.4,5121.0,369.0,450.0
26,"Mamaearth Mineral Based Sunscreen Baby Lotion SPF 20+,Hypoallergenic,100ml,(0-10 Years)",4.1,6953.0,214.0,299.0
27,Himalaya Gentle Baby Wash (400ml),4.3,17468.0,211.0,265.0
28,"Cable World® Musical Keyboard Mat Piano Gym Mat Gym & Fitness Rack,Pack of 1 set, Muticolor",3.8,10574.0,1099.0,2599.0
29,Himalaya Baby Lotion 700ml,4.4,7182.0,386.0,480.0
30,Mother Sparsh 99% Pure Water (Unscented) baby wipes I Natural Plant made cloth - Super thick I 72 pcs/pack - Pack of 2 (Su...,4.5,4056.0,399.0,568.0
31,"Luv Lap Liquid Cleanser Refill, Anti-Bacterial, Food Grade, For Baby Bottles, Accessories And Vegetables, 1000ml (Clear)",4.4,6544.0,359.0,479.0
32,Mother Sparsh 99% Pure Water (Unscented) Baby Wipes I Natural Plant Made Cloth - Super Thick I 72 pcs/Pack - Pack of 3,4.5,6627.0,598.0,897.0
33,Bio-Oil Original Face & Body Oil Suitable for Scar Removal | Uneven Skin Tone| Stretch Marks & Ageing Signs for Glowing Sk...,4.1,35284.0,553.0,790.0
34,"Babique Unicorn Teddy Bear Plush Soft Toy Cute Kids Birthday Animal Baby Boys/Girls (25 cm, Pink )",4.1,5325.0,175.0,699.0
35,"Mamaearth Daily Moisturizing Lotion, 200ml",4.2,11080.0,152.0,199.0
36,"Pampers Premium Care Pants, Extra Large size baby Diapers, (XL) 36 Count, 12-17 kg Softest ever Pampers Pants,",4.5,2749.0,837.0,1199.0
37,"Amul School Pack Butter Pasteurised, 100 g",4.6,4402.0,63.0,65.0
38,Classic Mosquito Net for Double Bed | Queen Size Foldable Machardani | Polyester 30GSM Strong Net | PVC Coated Corrosion R...,4.2,61552.0,949.0,2000.0
39,"Huggies Complete Comfort Dry Pants Medium (M) Size Baby Diaper Pants, 26 count,7-12 kg with 5 in 1 Comfort",4.0,30295.0,243.0,320.0
40,"Colgate Toothpaste for Kids (3-5 years), Natural Strawberry Flavour - 80 gr Tube,Cavity Protection,0% artificial preservat...",4.2,2809.0,132.0,200.0
41,"Mamaearth Gentle Cleansing Natural Baby Shampoo, 400ml (White)",4.3,19845.0,289.0,399.0
42,Himalaya Extra Moisturizing Baby Soap (75g),4.3,12197.0,153.0,165.0
43,"LuvLap Tiny Giffy Sipper for Infant/Toddler 300ml, Anti-Spill Sippy Cup with Soft Silicone Straw BPA Free, 18m+ (Green)",4.1,8188.0,199.0,259.0
44,Supples Baby Wet Wipes with Aloe Vera and Vitamin E - 72 Wipes/Pack (Pack of 9),4.4,59138.0,539.0,1161.0
45,Amazon Brand - Solimo Cotton Buds - 200 Sticks (Pack of 2),4.3,6773.0,139.0,240.0
46,AMAZARA Baby Proofing Corner Guards I Pre-Taped Corner Protectors I Child Safety Edge Guards I 10 Pieces Brown,4.2,11784.0,316.0,599.0
47,"Little's Comfy Baby Pants - Premium, 12 Hours Absorption, Wetness Indicator, Cotton Soft, Large,White, 62 Count",3.9,1730.0,625.0,999.0
48,Mee Mee Anti-Bacterial Baby Laundry Detergent(1.5 Litre liquid),4.4,4555.0,600.0,799.0
49,"Little's Soft Cleansing Baby Wipes with Aloe Vera, Jojoba Oil and Vitamin E (80 wipes) pack of 2",4.4,102725.0,145.0,380.0
50,Mamaearth Deeply nourishing wash for babies (200 ml),4.3,11401.0,152.0,199.0
51,"LuvLap Mobby Little Spout Sipper, BPA Free, 240 ml, 6m+ (Blue)",4.0,5639.0,199.0,259.0
52,"LuvLap Elegant Baby Hair Brush and Comb Set, 0m+ (White)",4.2,7404.0,169.54,219.0
53,Sebamed Baby Cream Extra Soft 50m|Ph 5.5| Panthenol and Jojoba Oil|Clinically tested| ECARF Approved,4.5,6629.0,591.0,700.0
54,KidDough Furniture Safety Locks for Kids (10 White Locks),4.1,4853.0,399.0,550.0
55,Toyshine Kids Wooden Angle Geometric Blocks Stacker Shape Sorter Column Puzzle Stacking Set - B (21 pieces),4.6,5238.0,426.0,999.0
56,"Mamaearth Tea Tree Anti Dandruff Shampoo, With Tea Tree & Ginger Oil, 250ml",3.9,7376.0,324.0,349.0
57,"Johnson's Baby Skincare Wipes with Lid, 72s Twin Pack (Buy 2 Get 1 Free) (432 Wet Wipes), White",4.5,6996.0,809.0,1290.0
58,Babique Octopus Sitting Plush Soft Toy Cute Kids Animal Home Decor Boys/Girls (17 cm),4.2,1421.0,179.0,799.0
59,"Pampers All round Protection Pants, Small size baby diapers (4-8kg) 56 Count, Anti Rash diapers, Lotion with Aloe Vera",4.3,7447.0,630.0,849.0
60,"Pampers Active Baby Taped Diapers, Small size diapers, (SM) 46 count, taped style custom fit",4.5,65629.0,698.0,775.0
61,Aveeno Baby Daily Moisturising Lotion for Delicate Skin (227g),4.4,7064.0,715.0,1149.0
62,"Philips Avent Plastic BPA Free Material Aven Straw Cup SCF796/00 200 ML 1 Piece, Multi",4.3,10632.0,449.0,499.0
63,"Mamaearth Onion Hair Serum For Silky & Smooth Hair, Tames Frizzy Hair, with Onion & Biotin for Strong, Tangle Free & Friz...",3.9,7574.0,277.0,299.0
64,Chinmay Kids 4-in-1 Adjustable Baby Carrier Cum Kangaroo Bag/Honeycomb Texture Baby Carry Sling/Back/Front Carrier for Bab...,3.8,22213.0,499.0,999.0
65,Mamaearth Anti Hair Fall Spa Range Hair Care Set: Onion Shampoo 250 ml + Onion Conditioner 250 ml + Onion Hair Oil 150 ml,3.9,20757.0,964.0,1097.0
66,fizzytech Toys Talking Cactus Baby Toys for Kids Dancing Cactus Toys Can Sing Wriggle & Singing Recording Repeat What You ...,4.1,64.0,599.0,999.0
67,"Chicco Toothpaste, Strawberry Flavour for 12m+ Baby, Fluoride-free, Preservative-free,Cavity Protection (50 millilitre)",4.4,9932.0,148.0,179.0
68,"Huggies Complete Comfort Wonder Pants, Medium (M) Size Baby Diaper Pants, 50 count, with 5 in 1 Comfort",4.2,215914.0,567.0,699.0
69,"Philips Avent Natural Teat 4 Holes Fast Flow for 6months and above, Pack of 2",4.4,8627.0,325.0,335.0
70,Philips Avent Ultra Air Pacifier Pack of 2 | High Ventilation | 98% Acceptance | BPA-Free | for Babies from 0-6 Months (Mo...,4.3,200.0,530.0,550.0
71,"Olay Natural Aura Vitamin B3, Pro B5, E With Uv Protection, 40g",4.2,10665.0,160.0,189.0
72,"Protinex Mama Nutritional Drink - (Chocolate Flavor, 400 Gms, Jar) with 28 Vital Nutrients to Support Healthy Birth Weigh...",4.3,6649.0,649.0,675.0
73,Sebamed Baby Body Lotion 100 ml|Ph 5.5|Camomile & Allantoin| Dermatalogically tested| Sensitive skin,4.5,4529.0,408.0,510.0
74,"Jesa Homes Polyester Adults Mosquito Net for Dubble Bed, Strong 30GSM net, High Durability, Foldable, Tent Shape Mosquito ...",5.0,2.0,579.0,1999.0
75,Philips Avent Natural 2. 0 Blue Feeding Bottle 260ml SCF035/10,4.6,1500.0,554.0,575.0
76,AMAZARA Baby Proofing Edge & Corner Guards | Extra Long 16.4Ft Edge + 8 Pre-Taped Corner Protectors | Child Safety Furnitu...,4.2,9076.0,633.0,999.0
77,"Einstein Box Gift Set for Babies, Newborns and Infants of Age 1-3-6-9-12 Months | High Contrast Gift Set with Set of Rattl...",4.4,1723.0,699.0,999.0
78,"MamyPoko Pants Extra Absorb S136,Unisex Baby, Pack of 136",4.0,174.0,1238.0,1998.0
79,Supples-Comfy Pants-M-34,4.0,127863.0,260.0,399.0
80,"Mamaearth Coco Soft Body Lotion with Coconut Milk & Turmeric, for babies, for 24-Hour Moisturization - 400 ml",4.1,152.0,314.0,449.0
81,"Himalaya Herbals Under Eye Cream, 15ml",3.8,6804.0,168.0,200.0
82,"MamyPoko Pants Extra Absorb XL32,Unisex Baby, Pack of 32",4.2,107.0,575.0,799.0
83,Wembley Dancing Monkey Musical Toys for Kids Baby Spinning Rolling Doll Tumble Toy with Voice Control Musical Light and So...,3.6,197.0,399.0,699.0
84,"Johnson's Baby Lotion For New Born, 500ml",4.5,9538.0,347.0,375.0
85,"LuvLap 100% Cotton Muslin Baby Swaddle Set, Printed Muslin Swaddle Wrap for New Born Baby, Size-120cm x 100cm, 0-18 Mont...",4.5,5228.0,639.0,839.0
86,"The Moms Co. Tear-Free Natural Baby Body Wash with Calendula, Avocado Oils & USDA-Certified Organic Oils Like Argan, Chamo...",4.4,3966.0,489.0,699.0
87,"Luv Lap Baby Diaper Pants S Size (Small) , with Aloe Vera Lotion for rash protection, Pack of 78 Count, with upto 12Hr pro...",4.0,12797.0,836.0,999.0
88,"Luv Lap Turtle Shaped Baby Manual Toothbrush & Toddler Toothbrush, Extra Soft with 10,000 Ultra Soft Floss Bristle for Bab...",4.2,382.0,65.0,79.0
89,"Luv Lap Washable Maternity Nursing Breast Pads, 6 Pcs, Reusable, Leak-proof",3.9,3155.0,289.0,349.0
90,Hamdard Safi Blood Purifier Syrup Skin Care Pimple Free for Natural Glowing Skin 500 ml,4.2,1437.0,208.0,230.0
91,"Luv Lap LuvLap Steel Feeding Baby Bottle, BPA Free Anti Colic, Made of SS304 Steel, Handle, 3M+ - 240 ml",4.1,1399.0,565.0,599.0
92,Mamaearth Aqua Glow Gel Face Moisturizer With Himalayan Thermal Water and Hyaluronic Acid for 72 Hours Hydration 100ml,4.2,963.0,593.0,699.0
93,"LuvLap Super Soft Baby Toothbrush, Ultra Soft baby toothbrush with High Density unique 10,000+ Floss Bristles for ultimate...",4.3,105.0,148.0,179.0
94,Wowper Fresh Baby Diaper Pants | Medium Size Diapers | Diapers with Wetness Indicator | Upto 10 Hrs Absorption | 7-12 Kg |...,3.7,3383.0,545.0,798.0
95,"Aveeno Baby Soothing Relief Moisture Cream Fragrance Free, 227g",4.4,5961.0,934.0,999.0
96,"Little Angel Extra Dry Baby Pants Diaper, Small (S) Size, 120 Count, Super Absorbent Core Up to 12 Hrs. Protection, Soft E...",4.0,46531.0,893.0,1498.0
97,"BLOOMBUDDY Organic Growth Booster Fertilizer Manure for plants (1 KG, Granules), Pack of 1",4.0,3772.0,312.0,2475.0
98,Classic Mosquito Net for Double Bed | Queen Size Foldable Machardani | Polyester 30GSM Strong Net | PVC Coated Corrosion R...,4.2,61552.0,899.0,2000.0
99,Wowper Fresh Baby Diaper Pants | Extra Large Size Diapers | Diapers with Wetness Indicator | Upto 10 Hrs Absorption | 14-1...,3.7,3383.0,536.0,798.0
100,Philips Avent Natural 2. 0 Pink Feeding Bottle 260ml SCF034/10,4.5,1129.0,450.0,575.0
101,"Luv Lap Jungle Time Double Sided Water Proof Baby Play Mat, Reversible Play mats for Kids, Baby Carpet, for Crawling Baby,...",3.7,92.0,1325.0,1599.0
102,Babique Pluto Sitting Plush Soft Toy Cute Kids Animal Home Decor Boys/Girls (30 cm),4.2,1263.0,309.0,899.0
103,"Colgate Kids Toothpaste with 0% Artificial Preservatives, Colours, Sweeteners for Whitening (6-9 Years, Natural Strawberry...",4.2,1209.0,132.0,195.0
104,"Luv Lap Baby Safety Electrical Socket Plug Cover Guards, White,5Pcs",4.2,1536.0,129.0,179.0
105,"Philips Avent Advance Bottle sterilizer SCF291/00|| 10 mins Cycle, Natural steam Sterilization, Capacity Of 6 Baby Bottles",4.3,1686.0,4140.0,4995.0
106,"Pikipo Plush Soft Ball (Small Size, 11cm) and Kitty Face Soft Rattle Combo, Multicolor (Material: Polyester & Plush)",4.3,979.0,284.0,399.0
107,"Chicco Toothpaste, Strawberry Flavour for 1Y to 6Y Baby, Fluoride-Free, Preservative-Free,Cavity Protection (50g)",4.1,31.0,157.0,179.0
108,"Supples Baby Wet Wipes with lid Enriched with Aloe Vera, 72 Wipes/Pack (Pack of 4)",4.4,59138.0,289.0,596.0
109,ANTIL'S® Baby Carrier Bag/Adjustable Hands Free 4 in 1 Baby/Baby Safety Belt/Child Safety Strip/Baby Sling Carrier Bag/Bab...,3.7,2529.0,394.0,1499.0
110,"Luv Lap Baby & Mother Electric Nail Trimmer, Filer Cum Manicure Set, Ergonomic Design, Safe for Baby/Kid, Nail Filer and G...",3.6,524.0,579.0,825.0
111,"BabyGo Cushioned Potty Seat, Toilet Seat with Handle for Kids (Blue)",4.2,12918.0,314.0,545.0
112,"Mamaearth Vitamin C Day Cream For Face, with Vitamin C & SPF 20, for Skin Illumination - 50g",4.0,3182.0,556.0,599.0
113,"Pampers Premium Care Pants, Medium size baby Diapers, (M) 162 Count Softest ever Pampers Pants,",4.5,1459.0,2667.0,3597.0
114,"Boniry Push Pop it Bubble Fidget Toy, Stress Relief and Anti-Anxiety Tools Sensory Toy for Autism to Relieve Stress for Ki...",4.1,1706.0,149.0,699.0
115,"LuvLap Banana Time 210ml Anti Spill, Interchangeable Sipper / Sippy Cup with Soft Silicone Spout and Straw BPA Free, 6m+ (...",4.2,4509.0,239.0,315.0
116,"Babique Plush Soft Toy Cute Kids Animal Home Decor Boys/Girls/Baby (10 cm, Rattle Ball)",3.8,915.0,105.0,999.0
117,"Synlark Baby Head Protector, Adjustable Size Baby Learn to Walk Or Run Soft Safety Helmet, Infant Anti-Fall Anti-Collisio...",4.1,93.0,299.0,699.0
118,"MamyPoko Tape Diapers for Babies, New Born mini, Pack of 30",4.3,155343.0,569.0,600.0
119,"Oral B Vitality Criss Cross Electric Rechargeable Toothbrush with Travel Case, with replaceable brush head included (White...",4.1,6870.0,1740.0,1999.0
120,"Colgate Kids Barbie Manual Toothbrush,Multicolor,1 Piece",4.4,1121.0,63.0,79.0
121,DearJoy Big Fibre Filled Baby Pillow and Stuffed Animal Elephant Soft Toy of Plush Hugging Pillow Material for Kids Boy/Gi...,4.3,3983.0,585.0,2000.0
122,"BabyPro Lab Tested - Certified (Set of 5) Baby Proofing Combo of 2 Metres Edge Guard & 4 Corner Protectors, Thin & Sleek D...",4.0,1515.0,349.0,500.0
123,"Pigeon Strawberry Toothpaste, For babies and Children,Fluroide -free,SLS free,Color free,Paraben Free, PH friendly,45 pack...",4.3,6018.0,264.0,330.0
124,Sebamed Baby Powder 400g |With Olive Oil and Allantoin| For delicate skin,4.5,9830.0,912.0,1040.0
125,"Atogla Curatio Lotion for Baby, 400ml Intense Moisturizing Baby Lotion for All Skin Types, Protects Against Rashes & Preve...",4.4,39.0,797.0,950.0
126,"BeyBee Bed Protector Sheet (Small (50cm X 70cm),Cotton,Salmon Rose)",4.3,39814.0,147.0,199.0
127,"Pampers Premium Care Pants, Large size baby diapers (L), 176 Count, Softest ever Pampers pants",4.2,35.0,3335.0,4796.0
128,Huggies Extra Small / New Born (XS / NB) Tape Baby Diapers (72 Count),4.2,16605.0,1049.0,1099.0
129,Himalaya Anti-Dandruff Hair Cream | Removes & Prevents Dandruff | Non Sticky Oil Replacement Hair Cream | Soothes Scalp | ...,4.0,1405.0,89.0,100.0
130,Wowper Fresh Baby Diaper Pants | Large Size Diapers | Diapers with Wetness Indicator | Upto 10 Hrs Absorption | 9-14 Kg | ...,3.7,3383.0,541.0,798.0
131,Philips Avent My Bendy Straw Cup 300ml/10oz (12M+) (Assorted),4.2,4143.0,484.0,499.0
132,"Little Angel Extra Dry Baby Pants Diaper, Large (L) Size, 48 Count, Super Absorbent Core Up to 12 Hrs. Protection, Soft El...",4.0,46531.0,503.0,799.0
133,"DEVICO Rai Mustard Seeds Pillow with Lavender, Baby-Round Head Shaping Baby Pillow,Neck Support Pillow Gifting 0-12 Months...",4.5,6322.0,474.0,999.0
134,MamyPoko Pants Extra Absorb S52,4.4,11.0,534.0,799.0
135,"Luv Lap Steel Feeding Bottle,SS304 Steel, Rust Free Stainless Steel, Ergonomic Handle, BPA Free, Odour Free, Nipple has An...",4.1,1399.0,487.0,599.0
136,"Chicco Baby Moments Talcum Powder with Natural Ingredients, Soothes & Moisturises Baby’s Skin, Dermatologically Tested, Pa...",4.4,2290.0,185.0,189.0
137,"LuvLap Hippo Spout Sipper for Infant/Toddler, 225ml, Anti-Spill Sippy Cup with Soft Silicone Spout BPA Free, 6m+ (Pink)",4.0,9297.0,199.0,265.0
138,BabyChakra Moisturizing Natural Baby Sunscreen SPF 30+ PA+++ UVA/UVB Protection Non-Sticky & Water-Resistant (60gm),4.1,170.0,144.0,175.0
139,"Cetaphil Baby Daily Moisturizing Lotion 400ml with Organic Calendula for Face & Body, Moisturizer for Kids",4.5,2083.0,1279.0,1425.0
140,"Colgate Kids Strawberry 40g Toothpaste, Cavity Protection",4.4,751.0,61.0,62.0
141,HARISTAR Scooter Style Baby Potty Seat with Wheel and Removable Tray for Kids | Available Wheel | Multi Color Scooter,3.9,1677.0,497.0,799.0
142,"Huggies Complete Comfort Wonder Pants, Small (S) Size Baby Diaper Pants, Combo Pack of 2, 56 count Per Pack, (112 count) w...",4.2,215914.0,979.0,1498.0
143,The Moms Co. Everything for Baby with Suitcase Gift Box and 7 Skin and Hair Care New born Baby Products |Baby gift set for...,4.4,1843.0,1679.0,2399.0
144,Odomos Non-Sticky Mosquito Repellent Cream With Vitamin E & Almond - 50 Gm,4.4,1243.0,50.0,55.0
145,Decals Design StickersKart Wall Stickers Kids Giraffe Height Chart Removable Large Vinyl (Multi-Colour),4.1,6420.0,197.0,664.0
146,ZHUQUA 12 PCS Edge Protector for Furniture Table Corner Guards for Sharp Edges Silicon Corner Protector for Sharp Edges Ge...,4.6,81.0,299.0,329.0
147,"Little's Baby Pants Diapers Medium (M), 7-12 kg, 128 Count with Wetness Indicator and 12 Hours Absorption",4.0,61008.0,1349.0,1796.0
148,R for Rabbit Large L Size Premium Feather Diaper for Baby 9 to 14 kgs (70 Pack Offer),4.2,2388.0,1348.0,1926.0
149,"Decals Design 'Walking in The Garden Flower' Wall Sticker (PVC Vinyl, 70 cm x 25 cm), Multicolour",4.2,11334.0,129.0,664.0
150,Shalimar Baby Diaper Disposable / Nappy Bag Size 30.5 Cm X 40.5 Cm 6 Rolls (90 Bags),4.3,169.0,243.0,270.0
151,"Luvlap Anti-Colic Natura Flo Teat/Nipple for Wide Neck Bottle, 4pcs, Fast Flow, 6m+",4.2,3262.0,184.0,190.0
152,AMAZARA Baby Proofing Edge & Corner Guards | 6.5Ft Edge + 4 Pre-Taped Corner Protectors | Child Safety Furniture Cushions...,4.1,3537.0,316.0,599.0
153,KidDough Baby Proofing Extra Thick Safety Soft Cushion Edge Corner Protector Guard for Kids Safety - 10 pcs (Pre-Taped) (B...,4.2,3118.0,299.0,499.0
154,RSTER Silicon Corner Protector for Sharp Edges Table Corner Protector for Baby Bed Corners Edge Protector Child Safety Cor...,4.5,63.0,279.0,999.0
155,Cable World® Dancing Dog Toy with Music Flashing Lights(Multi Color),3.8,997.0,449.0,999.0
156,Amway NUTRILITE Fiber powedr (Pack of 200 gms powder),4.2,402.0,843.0,1095.0
157,"The Moms Co. Virgin Coconut Natural 10-in-1 Baby Hair Oil with Argan, Marula, Avocado, Bhringraj and Organic Amla, 200 ml",4.3,929.0,334.0,495.0
158,DearJoy Baby Bedding Set / Baby Bedding Mattress Set with Mosquito Net / Baby Bed Set and Baby Play Gym with Mosquito Net...,3.9,7176.0,610.0,2000.0
159,Mamaearth Charcoal Nourishing Soap With Charcoal and Mint for Deep Cleansing - 5x75g,4.0,1447.0,329.0,375.0
160,Himalaya Pure Hands | Hand Sanitizer - 500 ml (Lemon) (Packaging may vary),4.2,5715.0,245.0,250.0
161,SuperBottoms Dry Feel Langot - Pack of 6- Organic Cotton Padded Langot / Nappy with Gentle Elastics & a SuperDryFeel Layer...,4.1,678.0,799.0,1058.0
162,"Olay Total Effects Day Cream with Vitamin C, B5, Niacinamide, Green Tea for Normal, Dry, Oily & Combination skin, 20 gm",4.2,17330.0,351.0,399.0
163,"Cetaphil Baby Mild Bar for Face and Body-Pack of 2, 75g*2",4.4,52.0,389.0,436.0
164,Huggies Nature Care Baby Wipes - Plant Based with Aloe Vera & Calendula (72 x 1 Count),4.2,6492.0,141.0,199.0
165,Mamaearth Argan Shampoo - 250 ml + Argan Conditioner - 250ml,3.9,437.0,572.0,698.0
166,"Classic Mosquito Net for Baby | Bottomless Net for Infants, for Safe & Easy Use | Ensures Your Baby's Safe Sleep |135cmX65...",4.0,144.0,799.0,1499.0
167,Mamaearth Tan Removal Combo(Ubtan - Face Wash 100ml + Face Scrub 100g),4.2,2114.0,525.0,598.0
168,Sajani Flashing Plastic Magic Lattoo Top Toy // Toy with LED Lights Music Attractive Toy // Non-Toxic and Safe Spinning To...,5.0,20.0,249.0,299.0
169,"Philips Avent Comfort Manual Breast pump, Natural Motion technology, combines suction and nipple stimulation, soft cushion...",3.9,350.0,1395.0,2195.0
170,"Khamasi Hand Casting Kit | 3D Couple Casting Kit, casting kit for couples,molding powder for hand casting, Best gift for c...",4.4,386.0,1349.0,2999.0
171,"EASY SHOPE Baby Folding Mat Play Foam Crawl Waterproof Portable Kids Baby Toddler,Pack of 1,Multicolor",4.4,275.0,1849.0,3999.0
172,R for Rabbit Large L Size Premium Feather Diaper for Baby 9 to 14 kgs (92 Combo Pack Offer),4.2,2388.0,1747.0,2592.0
173,"Giggles Funskool Digger The Dog, Pull Along Toy, Encourages Walking,Funny Walking Style, 12 Months & Above, Infant And Pla...",4.3,3610.0,608.0,699.0
174,IMTION® Duck Baby Bathing Rubber Squeaky Ducks Floating Play Water Pool Tub Toys Chu Chu Duck (Yellow) - 4 Pcs,3.0,2.0,74.0,200.0
175,eHomeKart Wave Plain Adjustable 3-in-1 Plastic Swing for Kids (Multicolour),4.3,2198.0,1229.0,1350.0
176,CURATIO Tedibar Baby Bathing Bar -75 gm Each - Pack of 4,4.5,833.0,520.0,700.0
177,"Mylo Essentials Cloth diapers for babies with 2 Free Insert, Oeko Tex Certified for 3Months to 3Years, Pack of 2 (Blue & Red)",3.4,2603.0,559.0,898.0
178,"Huggies Complete Comfort Wonder Pants with Aloe Vera, Large (L) size baby diaper pants, 64 count",3.3,2515.0,851.0,1199.0
179,"Sunuo Baby's Cotton Cloth Diapers/Langot Washable and Reusable Nappies (Multicolour, 0-6 Months) Pack of 10 Pieces (MULTI)",3.9,5361.0,299.0,799.0
180,"Sebamed Baby Cleansing Bar, 3.5-Ounce Boxes (Pack of 4)",4.5,273.0,955.44,1140.0
181,"Novo Baby Monthly Milestone Blanket | 1 to 12 Months | Best for Newborn Boy & Girl, multicolor, Cotton, skin friendly",4.6,1798.0,749.0,989.0
182,"Little Angel Premier Pants Baby Diaper, Small (S) Size, 112 Count, Cottony Soft Material, Wetness Indicator, Breathable La...",3.0,3.0,994.0,1398.0
183,Mee Mee Protective Baby Nail Clipper Cutter with Skin Guard (Green)(Pack of 1),4.0,1799.0,183.0,229.0
184,"Mother Sparsh Baby Laundry Liquid Detergent (Powered by Plants) with Bio - Enzymes and Eucalyptus Oil, Refill Pack (500ML ...",4.4,1872.0,437.0,599.0
185,"Pampers Premium Care Pants, Medium size baby Diapers, (M) 38 Count Softest ever Pampers Pants,",4.4,10830.0,726.0,749.0
186,"Mamypoko Standard Baby Diaper Pants, Medium (7 - 12 kg) 36 Count",4.2,77972.0,362.0,447.0
187,"Little's Baby Pants Diapers with Wetness Indicator and 12 Hours Absorption, Small (S), 4 - 8 kg, 168 Count",4.0,61008.0,1295.0,1716.0
188,"Aveeno Baby Gentle Wash & Shampoo with Natural Oat Extract, Tear-Free &, Lightly Scented, 18 fl",4.4,211.0,1589.0,1999.0
189,"Huggies New Dry Medium (M) Size Diapers for Babies(5-12 Kg),Combo Pack of 2,60 Counts Per Pack (120 Counts)",3.9,26116.0,1438.0,1998.0
190,"RYLAN Baby Kids Water Play Mat Toys Inflatable Tummy Time Leakproof Water Play Mat, Fun Activity Play Center Indoor and Ou...",4.1,1627.0,299.0,999.0
191,"JUSTLIST New Born Baby Infant Soft Cotton Mitten Sets with Cap and Booties (Set of 4, Availability Colour May Vary and Pri...",4.0,314.0,399.0,699.0
192,"Pigeon by Stovekraft Hard Anodised Pressure Cooker 3 Litre (14547) Induction Base, Inner Lid, Black, Aluminium",4.2,1733.0,1195.0,2549.0
193,LuvLap CAPS Booties Mittens Set Helicopter Bear FACE Print PO2,4.0,2439.0,270.04,398.0
194,"First Trend Silicone Teether for Soothing Babies Gums (Multicolor,Pack of 1)",3.7,197.0,89.0,399.0
195,"Toyshine Sun and Moon Wooden Shape, Objects, Color Recognition Rolling Bead Maze Labyrinth Toy",4.2,179.0,675.0,1499.0
196,Chinmay Kids 4-in-1 Adjustable Baby Carrier Cum Kangaroo Bag/Baby Carry Sling/Back/Front Carrier for Baby with Safety Belt...,3.8,22213.0,499.0,999.0
197,Supples Baby Diaper Pants L Pack of 3 Super Jumbo Box (2.5 kg - 12.0 kg) (186 Count),4.0,127863.0,1769.0,3147.0
198,DearJoy Baby Safety Helmet also used as Baby Head Protector + Kneepads (Orange Helmet & Pink Kneepads),3.8,6696.0,475.0,2000.0
199,"Mamaearth Rose Body Lotion with Rose Water and Milk For Deep Hydration - (400ml, All Skin Types)",4.2,2831.0,381.0,449.0
200,LILTOES Baby Safety Helmet Royal Blue,4.1,318.0,475.0,1299.0
201,"Mamypoko Extra Absorb Pants for Babies, Pack of 1, Size : XXL : 51 count (36+15)",4.3,2054.0,1299.0,1398.0
202,"Mamaearth Niacin Toner For Face, with Niacinamide & Witch Hazel for Acne and Open Pores - 200 ml",4.1,858.0,350.0,399.0
203,LILBEE Potty Training Toilet Seat I Potty Seat with Handles Splashguard and Hanging Ring I Compact and Portable I White,4.6,63.0,499.0,900.0
204,"StarAndDaisy 360° Baby Walker Adjustable Height, Multi-Function Anti-Rollover Folding Walker with Height Adjustable 6-18 M...",4.4,2224.0,2649.0,4499.0
