,name,ratings,no_of_ratings,discount_price,actual_price
601,"TIDY SLEEP Diaper Changing Mat/Sleeping mats/Water Proof Bed Protector with Foam for New Born Baby, 3 Sheets (65cm x 45 c...",4.4,80.0,699.0,749.0
602,"BuddsBuddy Polypropylene Sipper Cup - Green, 150ml",3.9,42.0,187.0,249.0
603,1st Step Matte Collection BPA Free Polypropylene Hard Spout Sipper with Twin Handles for Easy Grip - Pink,3.7,32.0,242.0,269.0
604,Cotton Diaper Inserts Reusable (Pack of 6) Baby Washable Cloth Diaper Nappies Wet-Free Inserts for Babies Diaper having 5 ...,3.7,9.0,249.0,479.0
605,THE LITTLE LOOKERS Soft Plush Stretchable Baby Feeding Bottle Cover with Easy to Hold Strap | Cute Animated Overall Print ...,4.3,196.0,242.0,449.0
606,3S Star 2 Pair Baby Knee pad Kids Safety Crawling Elbow Cushion Infant Toddlers Baby Leg Warmer Knee Support Protector Bab...,3.7,35.0,120.0,999.0
607,"R for Rabbit Caramello Baby Kid Diaper Bag for Mother, Waterproof, Large Capacity Maternity Backpack for Travel (Black)",4.4,720.0,1899.0,2799.0
608,AJ DEZINES Kids Ethnic Wear Kurta Pyjama Waistcoat Set for Boys,4.0,1708.0,849.0,2999.0
609,Aashiya Trades Unisex Cotton Turban Kont Bow Cap (Pack Of 1) (j01_Pink_0 Months-3 Months),3.6,268.0,190.0,599.0
610,Silver Shine Mosquito Net Single Bed Foldable 2.4 mm Strong PVC Coated Steel Mosquito Protection (White Blue),3.8,65.0,599.0,1599.0
611,"Dr. Brown's Preemie Flow Silicone Options Narrow Neck Nipple C (Pack of 2, White)",4.3,106.0,474.0,549.0
612,"HASTHIP® Hair Bows Holder Wall Hanging Headband Hair Clips Organizer for Girls Room, Large Capacity Felt Storage Display f...",0.0,0.0,568.0,854.0
613,ZAVEZA - Home Kart Unicorn Velvet Cartoon Printed Pillow for Baby Pack of 2 ( Size -12 x 18 Inches ),3.9,38.0,339.0,799.0
614,Hopscotch Boys Cotton and Polyester Suspender Style Bow Applique Romper in Gray Color,4.0,248.0,1089.0,1199.0
615,Tickles Blue Shark Soft Toy Stuffed Soft Plush Toy For Kids 38 Cm,4.0,305.0,549.0,873.0
616,Shivranjani Sarees Nylon Mosquito Net Double Bed Nets For Size King Foldable Child Mosquitoes With Adults Maskito Of 6 Sav...,3.8,198.0,699.0,2499.0
617,Dr. Brown's Milk Powder Dispenser (Blue)(Pack of 1),4.5,620.0,474.0,499.0
618,Timios Banana and Honey Stars | Healthy Snacks for Kids | Natural Energy Food Product for Toddlers | Party Snack for Schoo...,3.4,54.0,184.0,240.0
619,"IS IndoSurgicals Head Circumference Measuring Tape, PVC, Reusable (Pack of 10 Pcs.)",4.2,95.0,379.0,699.0
620,Mee Mee Caring Baby Wet Wipes with Aloe Vera (72 pcs) (Pack of 12),4.2,83.0,846.0,1188.0
621,"Safe-O-Kid- Pure Metal Baby Safety Gate (75-85 cm) +4 Electric Socket Covers +4 Sharp Corner Guards, Adjustable, 2 Way Aut...",1.0,1.0,2174.0,5198.0
622,MESH Planet Mosquito Net for Window with Fiber Glass Mesh 5/4feet(150/120cm) 60/48Inches 1 Year Guarantee Without Stitched...,3.9,2865.0,299.0,399.0
623,"Safe-O-Kid- Extra Safe, Oral hygiene, Transparent Silicone Finger Brush Tongue Cleaner for Baby Teething/ Gums with Attrac...",4.2,875.0,124.0,299.0
624,"Pidilite Fevicreate Educational Game, Toddler's Craft Kit for Early Development, 7 Fun Learning Activities for Toddlers & ...",4.4,225.0,290.0,299.0
625,Kuber Industries Kids Bath Towel|Soft Cotton & Sides Stitched Baby Towel|Microfibered Super Absorbent Princess Pattern Tow...,5.0,5.0,196.0,499.0
626,J.B.COLLECTION Baby Girl's Pom Pom Frock,4.0,129.0,399.0,949.0
627,"Medela Manual Harmony Single Hand Breast Pump with Flex Shields for Comfort & Expressing More Milk, 6 Count",4.5,10622.0,1999.0,2499.0
628,"BabyChakra 99% Bamboo Water Soft Baby Wipes with Lid, Alcohol-Free 100% Natural Ingredients Dermatologically Tested, Made ...",4.2,74.0,294.0,498.0
629,Babyhug Super dry diaper pants (M),4.1,8.0,378.0,399.0
630,Aveeno Baby Calming Comfort Bath Lavender & Vanilla 18 Ounce,4.8,8535.0,1399.0,2499.0
631,Merries Pants - Exceptional Breathability Baby's Extra Extra Large Size Diapers (26 Count),4.6,42.0,1343.0,1399.0
632,"Adore Bottle Nipple and Straw Cleaning Kit, Multi Color Feeding Bottle Cleaner Brush (Cleaning Brush Kit) (Aventus)",4.2,49.0,255.0,349.0
633,"Baby Basket Mothercare All We Know Baby Oil, 300 ml",4.3,30.0,279.0,399.0
634,"KidDough Baby Proofing Door Stopper Finger Pinch Guard | Accidental Door Lock and Slamming Door Protection for Child, Babi...",3.8,296.0,349.0,450.0
635,"Jikonet Women's Cotton, Rayon Maternity Gown Feeding Kurti",4.5,2.0,499.0,999.0
636,"TechHark ® Folding Activity Throw Fun Activity Ball for Kids, Multicolour.",3.9,45.0,179.0,499.0
637,"BabyChakra 100% Natural Foaming Handwash for Infants & Kids, 99.9% Germ Protection & Baby-Safe Certified, Goodness of Tuls...",5.0,3.0,270.0,410.0
638,Mylo Essentials Pre & Post Maternity/Nursing Maxi Dress with Both Sides Zipper for Easy Feeding,4.0,66.0,1269.0,1449.0
639,NammaBaby Baby Girls' A-Line Mini Frock Dress,4.1,1186.0,399.0,999.0
640,Medela Calma Breast Milk Feeding Nipple,4.1,2241.0,1450.0,1699.0
641,"LuvLap Memory Foam Baby Head Shaping Pillow, Baby Pillow for Preventing Flat Head Syndrome, 25 cm X 21 cm X 4.2 cm, 0m+, B...",4.2,81.0,519.0,649.0
642,Jay Gopal Fashion Use and Throw Disposable Panties Healthy Maternity Pregnancy Printed Panties for Girl's (White) (Pack of...,4.0,2.0,209.0,299.0
643,Baby Collection Baby Boy's & Girl's Cotton Front Open Vest Jhabla Perfect for Summer Wear Kids T-Shirt Baby Sando Innerwea...,4.3,28.0,499.0,899.0
644,AV2 Women's Cotton Floral Maxi Maternity/Feeding Nighty,4.1,645.0,483.0,1399.0
645,Huggies Little Swimmers Diapers - Large - 10 ct,4.6,334.0,985.0,1999.0
646,"INFANTSO Non-Toxic Food-Grade Silicone Baby Teether, BPA-Free for Pain-Relief Easy Teething, for 2+ Months Babies (Waterme...",4.2,2315.0,333.0,558.0
647,"Deoxys Baby Play Mat -Extra Large 77""x70""- Anti-Slip & Waterproof - Foldable Play Mat for Baby (0-3+), Double Sided, 2 Des...",4.1,22.0,1489.0,3499.0
648,Whitewhale Men's Loose fit Harem Pants,3.7,785.0,599.0,999.0
649,"Baybee 3 in 1 Invictus Convertible High Chair for Kids with Adjustable Height and Footrest, Baby Toddler Feeding Booster S...",3.9,177.0,2699.0,3099.0
650,3BROS Unisex Baby Cotton Printed Sleepsuit,3.9,325.0,306.0,999.0
651,"R for Rabbit Baby Tusky Pacifier Ultra Light Soft Silicone Nipple, Orthodontic Design, BPA-Free for Kids of 6 Months +|Med...",4.0,387.0,251.0,297.0
652,EIO New Born Baby Rompers Sleepsuit Suits Jump Suit for Boys and Girls Set of 3,4.0,2138.0,399.0,1499.0
653,"The White Willow Baby Crib Half Wedge Pillow Used Under Mattress For Acid reflux, Colic , Anti Vomiting Special High Incli...",3.9,4371.0,999.0,1999.0
654,BabyGo Garden & School Toy Swing Junior,4.0,801.0,2199.0,2450.0
655,"First Kick New Born Baby Blanket Pack of Super Soft Bathrobe Baby Wrapper Cum Baby Bath Towel for Baby Boys, Baby Girls, B...",4.1,374.0,331.55,999.0
656,PEAHEN 5 in 1 Baby Cozy Carry Cot Cum Rocker (Brown),4.0,44.0,1599.0,1999.0
657,"LuvLap Instadry Extra Absorbent Quick Dry Sheet for baby, Baby Bed Protector, Waterproof baby sheet, 0m+ - Extra Large, 14...",5.0,2.0,917.0,1499.0
658,"Kassy Pop Baby Muslin Cotton Bath Towel - Also Usable as a Baby Blanket/ Swaddler, 105 X 105 cm",4.2,246.0,849.0,999.0
659,Kidbee Baby Kid's Cotton Pajama Track Pant with Rib Multicolor Print (Pack of 3 Pcs),3.8,66.0,299.0,699.0
660,Happy Matty Baby's Extra Absorbent Quick Dry Sheet Playmat Waterproof Reusable Washable Colourful Soft Comfortable Best fo...,3.8,63.0,685.0,1450.0
661,ARIEL Cotton Clothing Sets for Baby Boys & girls - Unisex Clothing sets Full Sleeve T-shirt & Pant,4.2,86.0,299.0,399.0
662,GRAND PITSTOP Grandpitstop - Waterproof Mirror Mount Fully Waterproof Bike / Motorcycle / Scooter Mobile Phone Holder Moun...,3.6,10.0,1852.0,3899.0
663,"SNOWIE SOFT® 300 Grams Baby Formula Dispenser, Portable Milk Powder Dispenser Container with Carrying Handle and Scoop, Fo...",4.3,23.0,597.0,818.0
664,Haus Alchemy Non-Slip Sturdy Bathroom Western Toilet Baby Potty Trainer Seat with Handle Splash Guard & Soft Cushion Fits ...,4.2,42.0,1099.0,1999.0
665,JAAMSO ROYALS Multicolor Zoo Animal Kid Tree Vinyl Self Adhesive Home Decor Wall Sticker (70 CM X 45 CM),3.8,250.0,185.0,499.0
666,"Pigeon Peristaltic Nipple L,For 9+ Month Babies,BPS Free,BPA Free",4.5,1289.0,95.0,99.0
667,"Funvention- for Little Scientist in Every Kid Engineered Wood Miniature Mechanical Models, Multicolour, 5 Years and Above,...",3.9,26.0,1169.0,1788.0
668,ROSEFAIR Jhoomer Musical Merry Go Round Automatic Toy Jhoomer with Soothing Sound for Toys (Multicolor),3.4,20.0,369.0,799.0
669,"Pigeon Disposable Breast Pads,Comfy Feel,2X Softer,Gentle on Skin,Stay Dry All Day,Aloe Vera Extract,Dermatologically Tes...",4.3,85.0,140.0,165.0
670,FOOTPRINTS Organic Cotton Kids Unisex Socks | 5-8 years | Pack of 3 Pairs | Colourful Stripes,4.0,321.0,299.0,499.0
671,"FunZoo Snow Penguin Soft Plush Stuffed Animal Toy for Kids,Childrens (Gray, 25 cm)",4.5,58.0,399.0,699.0
672,"SYGA High Chair for Baby Kids,Safety Toddler Feeding Booster Seat Dining Table Chair (with Cushion, Brown)",4.2,2785.0,3299.0,6500.0
673,"Johnson's Baby Powder Blossoms | With Sodium Citrate, Citric Acid | Pack of 1, 100g",4.4,1385.0,88.0,95.0
674,"Cotonex 100% Cotton Organic Muslin Swaddle for New Born Babies Blankets at Dinosaur Design 100x100cm (Pack of 3) (Blue), B...",4.0,23.0,449.0,499.0
675,BRANDONN Unisex Baby Flannel Jumpsuit Panda Style Cosplay Clothes Bunting Outfits Snowsuit Hooded Romper Outwear (Grey Sca...,3.7,503.0,495.0,1499.0
676,BabyGo Baby Bandana Bibs Apron with 2 Snap Buttons For Drooling Teething Feeding Super Absorbent 100% Organic Cotton For B...,4.4,153.0,399.0,549.0
677,Mother Sparsh Plant Powered Natural Hydrating Baby Wash With Avacado Oil & Coconut - 100 ml,4.1,39.0,164.52,225.0
678,"CURATIO Tedibar Baby Bathing Bar, 75 g",4.4,295.0,159.0,175.0
679,Babyhug Super dry diaper pants (L),4.1,8.0,395.0,399.0
680,"100% Muslin Cotton 4 Layer Dream Blanket for Newborn to 5 Years, Soft Baby Blanket, Muslin Baby Blankets for Girls & Boys,...",4.8,10.0,599.0,999.0
681,TechHark® Pack of 200pcs DIY Plastic Brick Set 4D Space Children Intelligence Plastic Pipe Blocks Building Toys Straws(100...,4.1,144.0,199.0,999.0
682,Superbottoms NEW UNO Freesize Cloth Diaper Set of 2| Cloth diaper for babies 3M to 3Y | Washable & Reusable cloth diaper |...,4.0,254.0,1278.0,1780.0
683,EIO Boys and Girls Cotton Pajama Pants Pack of 6,3.8,2621.0,499.0,1499.0
684,SuperBottoms Cloth Diapers for babies - UNO Super Value Combo pack - 6 Freesize UNO- New Version| Reusable Cloth Diapers f...,4.0,70.0,2999.0,5340.0
685,CLAP Baby Girl's Midi Dress (Pack of 4),4.4,888.0,899.0,1780.0
686,"Grafters Dinosaur Toy Pull Back Cars, 6 Pack Dino Toys for 3 Year Old and Up, Pull Back 4 Toy Cars and Friction Powered 2 ...",2.6,4.0,1099.0,1999.0
687,ABS Plating LED Flash Light Various Glow Patterns in The Dark Stress Relief Spinner (Multicolor),4.1,140.0,449.0,799.0
688,Fisher Price SB04 Multi Utility Convertible Baby Sleeping Bag (Multicolor) (470.0mm L X 320.0mm W),4.4,58.0,999.0,1299.0
689,Kidbee Babies Soft Cotton Hosiery Cute Print Ear Falp Tie Up & Knot Cap,3.6,217.0,365.0,899.0
690,"FARETO Baby Boy's Cotton Mittens & Socks (Multicolour, 0-6 Months) - Set of 12",3.9,905.0,450.0,1299.0
691,Baby Safety net for Staircase|Railing Guard for Baby Safety Balcony|Child Safety net for Balcony|Staircase Baby Safety|Sta...,4.1,88.0,799.0,1700.0
692,Real Basics Cotton Clothing Sets for Boys & girls - Unisex Clothing sets Full Sleeve T-shirt Pant & Cap,3.9,37.0,349.0,599.0
693,ONICORN Baby Proofing Edge and Corner Guard Protection Extra Thick & Wide Kindergarten DIY Child Safety Foam Cushion Furni...,3.7,136.0,379.0,599.0
694,Cherilo Little Bunny Spout Sipper for Infant/Toddler (210ml) | Anti-Spill Sippy Cup with Soft Silicone Spout & Straw | Det...,4.6,44.0,229.0,329.0
695,HENAL Women's Cotton Anarkali Comfortable Maternity Kurti Nursing Feeding Kurta Dress with Both Side Zippers,3.8,16.0,849.0,2999.0
696,ZUVINO Women's Maternity Feeding Tops for Mothers with Zip | Nursing Tops for Feeding Baby | Feeding Tops for Jeans | Plus...,3.6,220.0,599.0,2999.0
697,Antil's Baby Carrier Bag/Adjustable Hands Free 4 in 1 Baby/Baby sefty Belt/Child Safety Strip/Baby Sling Carrier Bag/Baby ...,3.7,2529.0,394.0,1499.0
698,"Pampers All round Protection Pants, Medium size baby diapers (MD), 28 Count, Anti Rash diapers, Lotion with Aloe Vera",4.2,250.0,398.5,399.0
699,Mylo Essentials Women's Rayon Printed Maxi Nursing Kaftan Dress Cum Nighty,4.0,70.0,1039.0,1699.0
700,"Melissa & Doug On the Go Water Wow! On the Farm (Reusable Water-Reveal Activity Pad, Chunky-Size Water Pen)",4.4,2833.0,499.0,549.0
701,EIO� New Born Baby Romper Body Suits Jump Suit for Boys and Girls Set of 3,4.0,1378.0,399.0,1400.0
702,Mosquito Repellent | Unica Natural Mosquito Repellent Refill Liquid | Pet & Baby Safe | Combo Pack of 5,3.7,9.0,459.0,475.0
703,"MosQuick Baby Girl's Hairbands, Soft and Elastic Bow Headband, Nylon Headband for Newborn, Infants and Toddlers, Pack of 3...",4.2,223.0,350.0,500.0
704,"Safe-O-Kid Newly Launched- Hair Washing Mug, Baby Shampoo Cup, Baby Shower, Baby Bath Tumbler, Rainer Blue",4.1,38.0,189.0,349.0
705,"Baybee Daisy Baby Bouncer and Rocker Chair with Soothing Vibrations, Multi-Position Recline, 3 Point Safety Belt & Removab...",4.1,26.0,4499.0,5999.0
706,Nagar International Baby Breastfeeding Pillow (Sky) Adjustable With Back Support And Removable cover,3.8,39.0,990.0,1500.0
707,"AdiChai Tritan Plastic Water Bottles with Straw, BPA Free SSipper Bottle, Anti-Leak With Cap Lock Design Kids Water Bottle...",3.7,7.0,509.0,800.0
708,Fareto® Combo of Baby Mattress with Net | Sleeping Bag | 4 Pcs Bedding Set(0-6 Months) (Purple),4.1,148.0,703.0,1999.0
709,Mee Mee 125Ml 2 In 1 Baby Feeding Bottle With Spoon (Green),3.7,932.0,184.0,229.0
710,MY ARMOR U Shaped Pregnancy Pillow for Sleeping | 6 Month Warranty | Full Body Pregnancy Pillows for Pregnant Women with W...,4.4,522.0,2199.0,3999.0
711,"Homiefix present Attrative Baby Potty Seater For Kids, Boys & Baby Girls In Green Colour.",4.4,3.0,369.0,999.0
712,FLAX ® Baby Boys & Baby Girls Regular Cotton Shorts (Pack of 10),3.6,94.0,499.0,1250.0
713,"Himalaya Gift Pack & Himalaya Total Care Baby Pants Diapers, Medium, 78 Count",4.5,26446.0,1396.0,2450.0
714,"VGRASSP Kid's ABS Material Musical Army Style Toy Gun with Music, Lights and Laser Light (25 Inch)",4.6,10.0,519.0,999.0
715,Hopscotch Baby Boys Cotton Solid Half Sleeves Jacket with Shirt and Pant Set in Gray Color,4.0,524.0,739.0,1379.0
716,"LuvLap Instadry Extra Absorbent Quick Dry Sheet for Baby, Baby Bed Protector, Waterproof Baby Sheet - Royal Blue, 0m+ - La...",4.3,1282.0,399.0,549.0
717,GOOGO GAAGA Googogaaga Boy's Cotton Full Sleeves Sweatshirt with Pant set in Yellow Color Set For Baby Boys,3.9,195.0,602.0,1400.0
718,Koochie-Koo 6-Layered Cute Cartoon Duck Designed Light Weight Soft Cozy Muslin Blanket for All Seasons Reversible Baby Bla...,4.4,178.0,879.0,1299.0
719,Luke and Lilly Baby Girls Cotton Frock - Pack of 6,4.0,341.0,499.0,1299.0
720,KUNKUN Foldable Mosquito Net for Single Bed ( Large Size 7x4x4 Feet ) :: Standard Quality (Black),3.7,41.0,999.0,2499.0
721,"TRU TOYS Wooden Montessori Analog Clock for Kids, Preschool Number Teaching Educational Learning Clock Toy - Multi Color (...",4.7,5.0,399.0,799.0
722,CHIU Unisex-Baby's Modern Shoes,3.9,1177.0,298.0,499.0
723,"Grandpitstop - 4-Sided Grip, Anti Shake & Stable Cradle Clamp with 360° Rotation Motorcycle/Bike/Scooter/Cycle Without Cha...",4.8,11.0,1899.0,2499.0
724,PATPAT Wooden Vintage Music Box Hand Crank Music Box Wooden Music Box Gift Vintage Can't Help Falling in Love Engraved Mus...,4.2,421.0,482.0,772.0
725,"VRITRAZ Cartoon Character Printed Little Cap for Kids, Baby Girls and Boys 3-12 Years",4.1,75.0,399.0,499.0
726,"Infantbond Baby Boy's & Baby Girl's Half Sleeves T-Shirt | Touch Button T-Shirts (Pack of 4)(Yellow,Red,White P,Blue) (12-...",4.0,144.0,557.07,1299.0
727,Himalaya Gental Baby Wash With Goodness Of Chickpea And Fenugreek 400 Ml,4.2,42.0,245.0,265.0
728,ANAB GI 6 Pack Squishies Mochi Squishy Toys Glow in The Dark Party Favors for Kids - Mini Kawaii Squishies Mochi Animals S...,1.0,1.0,399.0,699.0
729,"BABY FOREST Dulaar Pyar Talc-Free Baby Powder| With Chamomile Flower Oil, Jojoba Seed Oil, Marigold Seed Oil & Corn Starc...",3.4,4.0,660.0,695.0
730,Real Basics Cotton Fleece Clothing Sets for Boys & girls - Unisex Winter Clothing sets Full Sleeve T-shirt & Pant,4.2,127.0,399.0,649.0
731,THE LITTLE LOOKERS Soft Plush Stretchable Baby Feeding Bottle Cover with Easy to Hold Strap | Cute Animated Overall Print ...,4.2,38.0,233.0,449.0
732,"Styxon Kids Gym,Sport & Outdoor Space Hopper Ball Bouncing Inflatable Sit and Bounce Hop Ball 2 to 6 Year, Rubber - {Mult...",2.9,14.0,299.0,999.0
733,"Baybee 5 in 1 Baby Bottle Warmer & Sterilizer | Electric Baby Food,Water & Milk Heater & Defrost with Manual Temperature A...",4.0,579.0,1679.0,2299.0
734,Hopscotch Baby Boys Cotton and Spandex Half Sleeves Applique Bow Solid Romper in Blue Color,4.0,90.0,1226.0,1779.0
735,SuperBottoms Padded Underwear | Waterproof Pull up Underwear | Potty Training Pants for Babies | Pull up Unisex Trainers| ...,3.8,136.0,1374.0,1498.0
736,babeezworld Dungaree for Boys & Girls Casual Printed Pure Cotton-Pack of 2 (Multicolour),4.0,907.0,498.0,1399.0
737,Aarika baby-girls Clothing Set,3.7,891.0,194.77,1105.0
738,"JD FRESH New Baby Nail File Electric,Baby Nail Trimmer with 6 Grinding Heads Safe for Newborn Baby Baby Nail Clippers with...",3.5,331.0,499.0,999.0
739,Wembley Baby Play mat for Kids (Multicolor Turtle Play Mat),3.8,26.0,1999.0,4699.0
740,AZAD57 Spinning Top Z Achilles B-105 Starter Spinner with Handle Launcher,3.5,8.0,459.0,1299.0
741,Panchhi Store Corner Protector for Sharp Edges Clear Corner Guards High Resistant Adhesive Baby Proof Protector for Kids S...,3.1,425.0,121.04,299.0
742,"Dormyo Cradle Breast Feeding/Nursing Pillow (with Belt) Multifunction Pillow with 5 Different uses; 1 Year Warranty, Print...",4.2,139.0,849.0,1999.0
743,"Jikonet Women's Cotton, Rayon Maternity Gown Feeding Kurti",4.5,2.0,499.0,999.0
744,"PATPAT® Plush Animal Bunny Dancing Ears Hat, Rabbit Moving Ear Flaps and Press Paws for Girls Women Kids",4.2,204.0,450.0,839.0
745,T2F Boys Pants,4.1,361.0,699.0,1499.0
746,Gugzy Cute Panda Soap Box Holder with Cover Bathroom Storage Shelves Racks Floor Type Kitchen Sponge Drain Holder Supplies...,4.4,446.0,299.0,599.0
747,Rasayan Baby Boys Cotton Bow Applique Top and Pant in Black Color,3.2,32.0,689.0,1299.0
748,Silver Shine Mosquito Net Single Bed Foldable 2.4 mm Strong PVC Coated Steel Mosquito Protection (White Black),3.8,65.0,599.0,1599.0
749,Mirada Dark Brown Cute Plush Stuffed Monkey with Glitter Eye Soft Toy - 25 cm,4.3,315.0,549.0,599.0
750,Farlin Feeding Bottle Cleaning Fluid (700ml),4.4,81.0,472.0,650.0
751,BUMZEE Girls Full Sleeves T-Shirt & Pyjama Set,4.0,35.0,351.0,949.0
752,"Munchkin Miracle Stainless Steel 360 Sippy Cup, Green, 10 Ounce",4.4,6939.0,1648.0,2299.0
753,VRION Summer Special Inflatable Kid Swimming Pool Baby Bath tub Without Air Pump I Bath Pool for Kids Age 1 to 5 Years I 6...,4.4,11.0,1399.0,1999.0
754,Real Basics Cotton Clothing Sets for Boys & girls - Unisex Clothing sets Full Sleeve T-shirt Pant & Cap,3.9,37.0,299.0,599.0
755,APRIME ADDA Unisex Baby Crawling Anti-Slip Knee Pads Toddler Knee Protectors Learn to Crawl Socks Leg Warmers,3.9,66.0,189.0,499.0
756,Mustela Stelatopia - Emollient Baby Cream - with Natural Avocado & Sunflower Oil Distillate - Fragrance Free - 6.76 Fl Oz,3.9,24.0,1480.0,1850.0
757,Jack's Star Kids Soft Cotton Trackpants Lowers Pajama for Infants Toddler Boys and Girls with Bottom Ribs (Pack of 6),4.3,5956.0,717.0,1499.0
758,"Little's Soft Cleansing Baby Wipes (Pack of 8, 80 Wipes)",4.4,102725.0,757.0,1520.0
759,"Huggies Wonder Pants Small (S) Size Baby Diaper Pants, 20 count, with Bubble Bed Technology for comfort",4.2,215914.0,199.0,225.0
760,"X&Y Furniture for Growth Pink Papaya Bookends, Book Organizer, Star & Moon, Wooden Kids Room Decorative, Book Stopper for ...",5.0,2.0,899.0,999.0
761,Safe-O-Kid - Effective Finger Guard for Hinged Doors - Pack of 4,3.5,572.0,379.0,1497.0
762,MOROVIK 4 PCS Edge Protector for Furniture Table Corner Guards for Sharp Edges Silicon Corner Protector for Sharp Edges Ge...,3.6,59.0,219.0,999.0
763,"OYO BABY Mustard Seeds Pillow for Baby Head Shaper | sarso Pillow for New Born Baby 0 to 12 Month, Pink (Strawberry Printed)",4.6,62.0,399.0,849.0
764,minicult Cotton Pajama Pants with All Over Print for Boys and Girls (Multicolor Designs)(Regular Fit)(Pack of 5),4.0,26549.0,714.0,2999.0
765,JUGULAR Baby Boys T-Shirt Multicolour (Pack of 5),4.4,577.0,499.0,1299.0
766,Baby Forest Laad Pyaar Baby Bottle (160 ML),3.0,4.0,1665.0,1845.0
767,Lify Water Shoes Barefoot Aqua Yoga Socks Quick-Dry Beach Swim Surf Shoes for Women Men – 1 Pair,3.8,25.0,499.0,599.0
768,"DAKULO® Soft Cloth Swing New Born Baby Cradle/Ghodiyu/Khoyu Hammock in Cool Cotton with Net, Orange (with Steel Hangers)",4.3,71.0,489.0,899.0
769,Fareto Baby Boy's & Baby Girl's T-Shirts | T-Shirt | Tees(Pack of 5),4.0,3927.0,699.0,1999.0
770,"Kuchipoo Baby Girl Regular Fit Cotton T-Shirts (© Disney-TSHRT-349, Multi-Colored)",4.1,28.0,615.0,1899.0
771,Real Basics Cotton Clothing Sets for Baby Boys & girls - Unisex Clothing sets Full Sleeve T-shirt & Pant,4.0,420.0,399.0,699.0
772,"Johnson's Baby Milk and Rice Cream for Summer, 200 g",4.6,3.0,275.0,285.0
773,"OYO BABY Baby Bed Protector Sheet (Extra Large-( 200cm X 140cm), Sea Blue)",4.3,2138.0,949.0,1399.0
774,Fareto New Born Baby 3 in 1 Sleeping Bag Cum Baby Bed/Carry Bag/Baby Wrapper (0-6 Months)(Blue),4.0,173.0,292.0,699.0
775,BuddsBuddy Olive Oil Based Natural Wipes With Lid for Babies with the goodness of Aloe Vera & Olive Oil | Moisturizing wip...,4.4,354.0,341.0,375.0
776,Little Innocents® Big Size Fibre Filled Stuffed Animal Elephant Baby Pillow with Ball Soft Toy for Baby of Plush Hugging P...,4.2,3022.0,379.0,999.0
777,"BeyBee 3 in 1 Blanket Wrapper-Sleeping Bag for New Born Babies, Beige Plain, 72 x 68 cm",4.1,445.0,256.0,499.0
778,"Ikea Kalas Kid's Plastic BPA-Free Colorful Flatware, Bowl, Plate, Tumbler Set - 36 Pieces",4.5,215.0,683.0,899.0
779,The Root And Craft Kids Birthday Photoshoot Outfit Dress (12 Month-Black & White),3.9,87.0,599.0,1599.0
780,LuvLap Half Sleeve Boys T-Shirt & Shorts Sets,4.3,320.0,569.0,780.0
781,Jimmy Jammy Front Button Full Sleeves Unisex Baby T-shirt and Pyjama Set - Pack of 5,2.9,48.0,479.0,1355.0
782,"OREAYU™ Finger Toothbrush With Storage Case, Tongue Cleaner for Baby Teething/Gums, Food Grade Silicone Teeth Cleaner Oral...",4.2,39.0,99.0,199.0
783,"PLUSPOINT Building Block Toys ,Construction Kit, STEM Learning Building Bricks Set, Birthday Gifts for Kids Children Girls...",4.3,833.0,2499.0,2999.0
784,"EPISKEY® Baby Knee & Elbow Guard/pad for Crawling, Toddlers, Infant, Girl, Boys, Safety Protector Comfortable Cap for Leg ...",4.1,24.0,299.0,599.0
785,Baby Bucket Soft Cotton Baby Girl's & Boy's Panties Set of 6 (2-3 Years)-Dark-Coloured -10DC-2,4.4,101.0,550.0,699.0
786,Keshvam Big Size Building Blocks for 2 Year Kids Educational Toys & Lerning Toys Smart Activity Fun Indoors Games(70 pcs L...,3.4,18.0,399.0,599.0
787,Kuchipoo Unisex Cotton Animal Print Pajama Bottom (Pack of 5),4.2,2378.0,439.0,1299.0
788,MY NEWBORN Designer Baby AC Blanket -Pack of 1 (White Bear) | Boy Girl New Born Wrapper | 0-12 Months | Skin-Friendly | Gr...,4.0,44.0,329.0,900.0
789,VGRASSP Musical Crawling Baby Toy for Babies Kids Infants - Dazzling Lights and Dynamic Sound - Colour as per Stock,4.3,9.0,495.0,999.0
790,Bumtum Ultrahygiene Freesize Cloth Diaper for Babies 0 to 3 Years | Washable & Reusable Diaper and Cotton Soaker (Pack of ...,4.2,39.0,258.0,699.0
791,NYRWANA DELIVERING SMILES IN INIDA 6 Fairies Angel Princess Action Figures Birthday Christmas Gift (3.93-inch) 6 Fairy Dolls,4.1,332.0,499.0,849.0
792,IBLAY Machardani Net Double Bed King Size - 8x8 Ft Mosquito Netting for Bed (Peach),3.8,1686.0,550.0,999.0
793,Women's Cotton Floral Printed Anarkali Maternity Feeding Kurti,3.7,705.0,519.0,2499.0
794,"Esquire Spotty Baby Dining Chair with Footrest, Red Colour",4.0,253.0,1599.0,2399.0
795,SYGA 3 Layer Cute Bear Portable Baby Food Milk Powder Storage Box Bottle Container (Green),4.3,326.0,249.0,350.0
796,"Baby Story 100% Cotton Rompers/Sleepsuits/Jumpsuit/Night Suits for Baby Boys & Girls, Infants, New Borns",3.8,2274.0,499.0,1299.0
797,Nabhya Stainless Steel Baby Spout Sipper Cup for Kids Age 3 Months to 18 Months 250 ML (Purple),3.7,76.0,269.0,499.0
798,PEAHEN Baby Potty Training Seat (Pink),3.8,234.0,370.0,649.0
799,"KNITROOT Half Birthday Unisex Baby Romper Whilte Color Half Sleeve"" Yay I Am 6 Month Old"" (6-9 Months, KSBR22-3)",3.8,37.0,499.0,699.0
800,"Fisher-Price Baby Bear & Firefly Soother, Light-up Nursery Sound Machine with take-Along Plush Toy for Babies and Toddlers",4.6,434.0,1480.8,2299.0
801,Kids Basket Baby Boys and Girls 100% Pure Cotton White Vest Inner wear Combo Pack of 5 and 10 pc,4.0,1468.0,299.0,799.0
802,"Newborn Organic Cotton Sleeveless Baby Top Dress Set for Infants - Unisex for Girls & Boys(Pack of 4) (0-3 Months, White P...",4.2,6.0,599.0,999.0
803,Mylo Essentials Pre & Post Maternity/Nursing Maxi Dress with Both Sides Zipper for Easy Feeding,4.0,66.0,1269.0,1449.0
804,SCOOBA Super Soft 45cm Princess Doll - Polyfill Washable Cuddly Soft Plush Toy - Helps to Learn Role Play - 100% Safe for ...,4.2,313.0,595.0,999.0
805,"HUNK SHOPPERS See and Spell Learning Toys, Matching Letter Spelling Game Sight Words Games Educational Preschool Toys Lear...",4.0,13.0,499.0,1999.0
