,name,ratings,no_of_ratings,discount_price,actual_price
401,"Bumtum Baby Diaper Pants with Double Layer Leakage Protection - 12 to 18 Kg (108 Count, X-Large, Pack of 2)",4.0,1232.0,1339.0,2193.0
402,Mother Sparsh 99% Pure Water (Unscented) Baby Wipes I Natural Plant Made Fabric - Super Thick I 72 pcs/Pack - Pack of 10,4.5,6627.0,1920.0,2990.0
403,SHAYONAM 8 PCS Edge Protector for Furniture Table Corner Guards for Sharp Edges Silicon Corner Protector for Sharp Edges G...,3.1,952.0,246.0,259.0
404,"LuvLap Soft 100% Cotton Hooded Wrapper Cum Warm, Blanket, for New Born Baby to 3 Year Old, 75cmx75cm, Bus Print (Sky Blue)",4.1,470.0,249.0,345.0
405,"Storescent Reversible Octopus Soft Toys for Kids, Octopus Stuffed Animal Plush Soft Toys for Boys and Girls | Octopus Plus...",4.0,49.0,189.0,999.0
406,Webby Green Soft Dinosaur Plush Stuffed Toy 30cm,4.4,320.0,399.0,599.0
407,EIO New Born Baby Gift Set -13 Piecess (Pinkk),4.2,2958.0,649.0,1499.0
408,Bodyguard Aloe Vera Based Natural Wet Wipes For Babies With Goodness Of Vitamin E | Moisturizing Baby Wet Wipes For Baby's...,4.1,141.0,310.0,625.0
409,"Amazon Brand - Jam & Honey Yellow Unicorn Soft Toy, 35 cm",4.6,325.0,335.0,950.0
410,Mother Sparsh 98% Water Based Scented Wipes I Plant derived Fabric I mild Scented I 80 Pcs/Pack - Pack of 5,4.4,5189.0,716.45,990.0
411,"Batman Toys Organizer (Set of 2 pcs - Big & Small), Storage Box for Kids",3.7,154.0,365.0,999.0
412,Bestie toys Boomerang Glow in The Dark | Night Booma | Toys Kids & Adult | Returning Boomerang Multicolor,4.0,32.0,399.0,899.0
413,"GOLURK Cotton Baby Pajama Pants/Track Pants, Daily use Lower Pant for Kids boy and Girls Unisex(Pack of 6)",3.6,88.0,269.0,369.0
414,Jimmy Jammy Unisex Baby Boy & Girl Dress Soft Hosiery Cotton Blend T-shirt and Shorts Pack 6 T-shirt + 6 Shorts Multi colo...,3.7,172.0,459.0,1299.0
415,"Huggies Complete Comfort Wonder Pants with Aloe Vera, Small (S) size baby diaper pants, 86 count",3.3,2515.0,815.0,1199.0
416,BeyBee Quick Dry Waterproof Protector Dry Sheet - X-Large (Beige),4.3,39814.0,849.0,1395.0
417,"7 Days Stretch Marks Scar removal cream oil in during after pregnancy delivery women,organic Bio Oil for to remove Hyperpi...",3.9,55.0,227.0,599.0
418,BODY LOTION NAT SENS 500ML INTL,4.3,4380.0,1095.0,1349.0
419,BKDT Marketing Yo Yo Ball Toy for Boys Girls Kids Ball Play Set Adjustable Wrist Band yoyo (Pack of 1),3.7,245.0,219.0,359.0
420,"Mom's Darling Baby Bed Protector Waterproof Plastic Sheets, Urine Matress Protector Sheets, Baby Diaper Changing Sheet(0-1...",4.2,91.0,378.0,699.0
421,"OYO BABY Baby Bed Protector Dry Sheet for New Born Babies (Medium (100cm x 70cm), Voilet)",4.3,11146.0,193.95,325.0
422,"MAXI Lollipop Tongue Cleaner for kids, extra soft, 6+ months, watermelon, candy, multicolor (Pack of 4)",4.2,21.0,180.0,200.0
423,BeeBaby 3 in 1 Weaning Silicone Spoon Set with Dual End Spoon for Feeding Newborn/Baby (Blue),4.4,370.0,153.0,249.0
424,"BAYBEE Baby Chair, with Tray Strong and Durable Plastic Chair for Kids/Plastic School Study Chair/Feeding Chair for Kids,P...",3.9,1531.0,1099.0,1999.0
425,"Little Pumpkin Kiddie Kingdom Baby Stroller, 3 Position Recline, Pram for Kids and Infants, Adjustable Backrest, 360° Swiv...",4.2,1159.0,3699.0,4995.0
426,"Cotton Cloth Premium Baby Washable, Reusable, Absorbent, Extra Soft Face Towels/Washcloth Muslin Cotton Cloth for Sensitiv...",4.8,34.0,449.0,699.0
427,Muma's Love Baby Fruit Feeder Pacifier (1 Pcs) with 1 PCS Silicone Baby Food Dispensing Spoon 90ML and 1 pcs Fruit Teether...,4.2,8.0,395.0,699.0
428,Webby Plastic Building Blocks Construction (Multicolour) - Set of 500 Pieces,3.9,73.0,1179.0,1299.0
429,"MY NEWBORN Multipurpose, New Born Baby Blanket Wrapper Towel Robe with Sheet -Set of 2 Pcs (Brown and White) (762.0mm L X ...",4.3,59.0,455.0,1800.0
430,REVOLTEK Printed Vest baniyan Cotton Inner wear for Baby Summer wear Cloth Sleeveless Undershirts for Kids Sando ganji Tan...,4.4,519.0,490.0,799.0
431,"Cetaphil Baby Daily Lotion, 400ml and Cetaphil Baby Gentle Wash and Shampoo, 230ml (Pack of 2)",4.6,137.0,1261.0,1420.0
432,"Baybee Stainless Steel Baby Spoon Set for Baby Feeding, Non Toxic BPA Free Training Feeding Spoon & Fork Set, Food Grade S...",4.5,41.0,319.0,399.0
433,7 Days Stretch Mark Cream | For Men Reducing Stretch Marks & Scars During Treatment- Effective & Fast Working -(100 g),4.7,14.0,327.0,599.0
434,"Meditive Reversible Baby Play Mat, BPA Free Learning & Crawling Foldable Foam Mat for Kids, Toddlers…",4.7,95.0,1599.0,1999.0
435,"Tikitoro Kids Daily Essentials Combo, Vegan Kids Body Wash (300 ml) & Conditioning Shampoo (300 ml)",4.4,15.0,990.0,1100.0
436,AmBaby Pack of 12 Super Absorbent Full Padded New Born Baby Nappies Langot|Breathable Adjustable Washable Reusable Soft Ho...,3.9,1232.0,329.0,499.0
437,Kiddery Maia | New Born Baby Cradle with Improved Mattress Design and Mosquito Net Protection | Palna for Comfortable Baby...,3.8,141.0,2999.0,5999.0
438,"HUG 'n' FEEL SOFT TOYS Unicorn, Soft Toy, Baby Toys, Kids Toy, Soft Toy, Toy for Girl, Birthday Gift for Girl/Boys, Toy Gi...",4.1,28065.0,238.0,799.0
439,"ELOSH Baby Nail File Electric - [2019 Upgraded] Safe Baby Nail Trimmer, Electric Nail Clipper with Light.",4.3,2216.0,270.0,999.0
440,Women's Cotton Floral Printed Anarkali Maternity Feeding Kurti,3.7,705.0,519.0,1099.0
441,Amitasha Educational Tablet Toy for Kids,3.1,39.0,299.0,799.0
442,"Bumtum Baby Diaper Pants with Double Leakage Protection - 9 to 14 Kg (62 Count, Large, Pack of 1)",4.0,1232.0,637.0,1099.0
443,Netra Creation Baby Girls Pink Sleeveless Printed Knee Lenght Net Frock Clothes Set,1.5,2.0,349.0,999.0
444,Teddyy Baby Easy Pant Diapers Medium 74 Count (Pack of 1),3.8,118.0,880.0,999.0
445,"BOFFLE® Cotton Swing Chair for Kids Baby's Children Folding and Washable1-6 Years with Safety Belt/Home,Garden Jhula for B...",4.0,700.0,749.0,1599.0
446,"Fareto Baby's Clothing Set (Multicolour, 0-6 Months) -Combo of 5 in 1",3.8,13.0,1230.0,2999.0
447,HUG PUPPY Home Product Image HUG PUPPY Baby Infant Toddler Helmet No Bump Safety Head Cushion Bumper Bonnet Adjustable Pro...,4.2,3.0,255.0,999.0
448,THE LITTLE LOOKERS for Philips Avent/Broad Neck Feeders Soft Plush Stretchable Baby Feeding Bottle Cover with Easy to Hold...,4.3,245.0,179.0,499.0
449,"Little Angel Premier Pants Baby Diapers, Medium (M) Size, 100 Count, Cottony Soft Material, Breathable, Extra Dry Core, St...",4.5,2.0,999.0,1398.0
450,"Phillips Avent Microwave Sterilizing Bag SCF297/05 | Kills 99.9% Germs | Sterilizes Bottles, Breast Pump and Baby Products...",4.8,23.0,725.0,995.0
451,HUG 'n' FEEL SOFT TOYS Soft Toys Long Soft Lovable Huggable Cute Giant Life Size Teddy Child Safe Best for Birthday Gift V...,3.9,107.0,539.0,1199.0
452,Herbalife Formula 1 Nutritional Shake Mix Kulfi 500 g,4.0,3946.0,1320.0,2276.0
453,AmazingHind King Size Family mosquito net for bed. Mosquito net for bed king size. Mosquito net for double bed with 40 GSM...,3.9,32.0,1376.0,1999.0
454,Softsens Baby Nourishing Lotion with Milk Cream & Shea Butter 200ml,4.3,429.0,140.0,165.0
455,"Mee Mee Reusable Water Proof Cotton Bed Protector Sheet /Extra Absorbent Mat/Dry Sheets/Urine Sheet/Dry Mat(Medium, Maroon)",4.2,314.0,228.0,329.0
456,"100% Muslin Cotton 4 Layer Baby Quilt for Newborn to 5 Years, Soft Dream Blanket, Muslin Baby Blankets for Girls & Boys, L...",4.4,43.0,599.0,1498.0
457,"tekme U Shaped Toothbrush for Kids, Food Grade Soft Silicone Brush Head, 360° Oral Teeth Cleaning Tools, Children Infant U...",3.6,185.0,299.0,999.0
458,Baby Soft Feeding Bibs/Apron Cute Multi Print|with Tich Button| Waterproof Newborn Baby Bib Set,4.1,211.0,175.0,999.0
459,Younique Mosquito Net for Baby Cradle Swing/Mosquito Net for Baby Jhula with Side Zip Opening (0-3 yrs) (Blu n Wht),4.4,1136.0,499.0,700.0
460,New Elite Women's Rayon Maternity Feeding Kurti with Zipper and Belt for preganant Women,4.1,44.0,699.0,2699.0
461,SPUNN Women's Cotton Non-Padded Wire Free Nursing Bra,3.7,368.0,347.0,999.0
462,Trinkets & More - Hammer Ball Musical Xylophone Musical Toy Wooden Pounding Bench with Box Case Instrument for Kids 2+ Yea...,3.9,2828.0,759.0,899.0
463,"PATPAT®Crib Hanging Toy for Babies, Electric Rotation Crib Soothe Toy Multifunctional Crib Hanging Toy with Lullabies, Tim...",4.2,22.0,1899.0,3359.0
464,"Dreambaby 2 Up Step Stool, Grey",4.7,3069.0,799.0,999.0
465,HUMSAFAR Waterproof Mattress Protector-Water Proof Rubber Bed Sheet for Baby & Adult/Water Resistant Urine Mat/Oil Cloth/M...,3.3,5.0,475.0,999.0
466,StarAndDaisy Folding Baby High Chair Recline Highchair Height Adjustable Feeding Seat Wheels *Upgraded Version with Wheel ...,4.0,930.0,3799.0,8999.0
467,"PLUSPOINT Baby Phone Toy for 1 2 3 Year Old with Light, Music - Phone Toy for Baby 6-36 Months Toddler Kids Educational Ph...",3.8,703.0,499.0,799.0
468,BKDT Marketing Yo Yo Ball Toy for Boys Girls Kids Ball Play Set Adjustable Wrist Band yoyo (Pack of 2),3.7,245.0,293.0,299.0
469,NCY 4 in 1 Adjustable Baby Carrier Cum Kangaroo Bag/Baby Carry Sling/Back/Front Carrier for Baby (Navy Blue),3.6,642.0,329.0,999.0
470,Original Tilismi Moti by S. Abdur Rasheed for Teething Babies (Pack of 10) with Free Nazar Manka 2 Piece,4.2,105.0,230.0,300.0
471,"Funskool Giggles - Activity Ball, Learning Activity Toy, Multicolour, 12 Months & Above, Infant And Preschool Toys",4.4,4284.0,399.0,499.0
472,"SaleOn DIY Take Apart Toys Free Wheel Unbreakable Toys Puzzle Disassembly, Assembly, Removable, Educational and Learning T...",4.0,86.0,296.65,1499.0
473,Amso Portable Disposable Baby Diaper Nappy Garbage Bag with Removable Capsule Box (1 Capsule and 4 Multi Color Garbage Roll),4.6,16.0,299.0,1000.0
474,"Morisons Baby Dreams Bottle and Accessories Cleaner, 500ml Pack of 2",4.6,41.0,598.0,798.0
475,Toyshine Stunt Scooter Toy Lights and Sound Electric Car Model Toy Vehicles Toys for Toddlers Baby Kids Children Birthday-...,4.4,27.0,598.0,1299.0
476,Coolz Kids Chu-Chu Sound Musical First Walking Shoes Star-7 for Baby Boys and Baby Girls for 9-24 Months,4.2,389.0,339.0,499.0
477,DOTMOM Premium Ultra Soft Organic Bamboo 3 in 1 Baby Hooded Bath Towel (White),4.6,102.0,1499.0,2999.0
478,Freshfoot Baby's Organic Cotton Ankle Socks For 0-12 Months- 6 Pairs,3.8,613.0,398.0,799.0
479,Coolz Kids Chu-Chu Sound Musical First Walking Sandals C-06 for Baby Boys and Baby Girls Age 12-24 Months,4.2,5914.0,349.0,499.0
480,"OLWICK® 1 Pcs Extra Thick Furniture Edge Protectors High Dense Foam Cushion Baby Safety Corner Strip Guards, 6.5 Ft Furnit...",4.2,52.0,399.0,799.0
481,Mudgal India Creations Cotton Cute Collection Summer wear(Pack of 4 Nos) Dress Cum Baby Girl Jhabla/Frock (Color May be Ch...,3.5,96.0,350.0,1100.0
482,Infantbond Combo of Baby Mattress with Net | Sleeping Bag | 4 Pcs Bedding Set | 4 Waterproof Sheets(0-6 Months) (Moon Pink),4.0,440.0,1023.0,1999.0
483,"Chicco Baby Moments Mild Body Wash Refresh, New Advanced Formula with Natural Ingredients, No Tears & Soap-Free, Mild form...",4.0,31.0,185.0,229.0
484,"BEEBABY Soft Silicone Spout Sippy Cup with Detachable Handle, 100% BPA Free and Leak Proof Sipper for 9 Months Toddlers an...",3.9,674.0,156.0,299.0
485,Mothercare Fragranced Wipes ( 60pcs x 5pkt) (Purple),4.1,87.0,624.0,895.0
486,SuperBottoms NEW UNO Freesize Cloth Diaper | Cloth diaper for babies 0 to 3 years | Washable & Reusable cloth diaper | Com...,3.8,3527.0,659.0,890.0
487,"LuvLap Booster Car Seat, Backless Design, for Children & Kids from 6 to 12 Years (Black)",4.3,625.0,1495.0,1899.0
488,"Inditradition Child Safety Form Cushion Strip (2 Meter) | Corner Edge Guard Bump Protector | Multipurpose Usage, 6.5 Feet,...",3.6,272.0,225.0,600.0
489,DABUR Oil Lal Tail - 100 ml,4.4,20873.0,97.0,120.0
490,"Pampers Baby Dry Diapers, New Born, 11 Count",4.1,331.0,164.67,189.0
491,"Gorangani Women's Cotton Printed Soft Loose Embellished Multipurpose Sleepwear Maxi, Nighty, Gown, Nursing, Feeding and Ma...",3.6,58.0,325.0,999.0
492,"PDSPM Learning Cushion Pillow Book for Kids with 2 Languages ​​to Learn - English and Hindi, Soft Fabric Cloth Books, Deve...",4.6,275.0,399.0,1199.0
493,minicult Unisex Cotton Baby Vest (Pack of 6) (Multicolor)(Assorted Prints Will be Sent),3.8,540.0,596.0,1299.0
494,CEE 18 Women's Cotton Non-Padded and Non-Wired Maternity Nursing Bra for Women's | Adjustable Shoulder Straps | Post Pregn...,4.2,7994.0,621.0,999.0
495,AARAM Ultrasoft Waterproof Dry Rubber Cloth for Bed Protection/Toddler Sleeping Mattress Protector/Urine Non-Absorbent Reu...,4.2,548.0,760.0,809.0
496,Mee Mee Elegant Lightweight & Adjustable Baby Sling Carrier | 4 Carry Position Baby Carrier with Padded Support for 0 to 2...,3.9,1388.0,1223.0,1699.0
497,"The Moms Co. Baby Skin & Hair Care Bundle for Complete Care|With Shampoo (200 ml), Body Wash (200 ml) & Lotion (200 ml)|Ge...",4.3,609.0,848.0,1179.0
498,"1st Step Honey Comb Lining, Super absorbant Disposable Breast Pads Nursing Breast pad (Pack of 24)",4.4,48.0,199.0,229.0
499,EIO® 100% Cotton Rompers/Sleepsuits/Jumpsuit/Night Suits for Newborn Baby Boys & Girls Pack of 3,4.0,4382.0,599.0,1499.0
500,CeraVe Baby Lotion | 8 Ounce | Gentle Baby Skin Care with Hyaluronic Acid | Paraben and Fragrance Free | Packaging May Vary,4.7,6170.0,1669.0,4400.0
501,"aquawhite® Peppa Pig Flash Light Kids Toothbrush with Hygiene Cap & Rinsing Cup - Set of 3, (3+years)(Blue)",4.2,176.0,399.0,500.0
502,Women's Cotton Maternity Feeding Kurtis by Paritika Fashion,3.0,5.0,599.0,1499.0
503,STHIRA® 1Pcs Refrigerator Lock Freezer Door Lock Cabinet Lock Strong Adhesive Lock Window Door Restrictor Cable for Baby T...,4.1,390.0,661.0,888.0
504,"MY NEWBORN 3-in-1 Hooded Baby Towel Wrapper- Set of 2 (Unicorn Pink and Blue, 0 - 12 Months) | Multi-Purpose Wrap for Baby...",3.9,615.0,528.0,1800.0
505,"Philips Avent Ultra Air Pacifier for Boy, 6-18 Months, Blue/Green Fashion Decos, 2 Pack, SCF342/22",4.4,1268.0,400.0,405.0
506,EIO® 100% Cotton Rompers/Sleepsuits/Jumpsuit/Night Suits for Newborn Baby Boys & Girls Pack of 3,4.0,4382.0,599.0,1499.0
507,BABY GO 100% Pure Cotton T-shirt and Shorts Set for Baby Boys,4.3,228.0,399.0,999.0
508,Fabme Women's Cotton Textured Floor Length Nursing Nighty,3.6,4629.0,379.0,999.0
509,Savita Collection New Cute Trendy Cotton Fabric Summer wear Frock/jhabla/Maxi/midi Combo Set of 4 for Baby Girls,3.7,66.0,295.0,950.0
510,AYSIS Double Sided Water Proof Baby Mat Carpet Baby Crawl Play Mat Kids Infant Crawling Play Mat Carpet Baby Gym Water Res...,3.7,3335.0,784.0,1799.0
511,"Chic Buddy Waterproof Wet Bag, Washable, Reusable for Travel, Beach, Pool, Stroller, Diapers, Dirty Gym Clothes, Wet Swims...",4.4,280.0,339.0,479.0
512,"Toyshine Mid-sized Foosball, Mini Football, Table Soccer Game (51 Cms) - Lets Have fun Brown",4.2,2129.0,1907.0,3999.0
513,AWSM COLLECTION Kids Fiber Foldable Cartoon Princess Sofa Cum Bed Small Baby Sofa Chair for Room Decoration Gift Purpose (...,3.7,116.0,849.0,1999.0
514,"MOM CARE face Towels for Newborn Baby,wash Cloth for Babies, Extra Soft hankies,Reusable Napkins Ideal for Infants,Toddler...",4.2,415.0,299.0,499.0
515,Luv Lap 3 in 1 Rocker Napper - with Musical Vibrations - Red,3.8,2576.0,6396.0,10795.0
516,Mee Mee Portable Baby Bottle Warmer with Mee Mee Portable Baby Bottle Warmer with Quick USB Charging | 10 Mins to Warm Bab...,3.2,137.0,530.0,699.0
517,"Organic Netra Baby Kajal - Water Resistant, Smudge Proof, Long lasting for Normal Skin Type | Enriched with Natural and Or...",4.2,5690.0,449.0,498.0
518,Medela Contact Nipple Shields M (2 pcs),3.3,7169.0,360.0,400.0
519,motherly Women's Nylon Heavily Padded Wire Free Maternity Bra,4.0,2214.0,784.0,1049.0
520,Bodycare 73 Girls Cycling Shorts (Pack of 3),4.1,395.0,380.0,390.0
521,NL TRADERS Gyro Bowl for Baby and Kids Feeding Bowl Universal 360 Rotate Magic Funny Toys Baby Gyro Feeding Toy Bowl Dishe...,2.0,5.0,229.0,499.0
522,AVANI METROBUZZ Baby Mosquito Net Jhula Swing with Mosquito Net for New Born Baby 1-2 Years Babies-Newborn Baby Cotton Bab...,2.8,7.0,1599.0,4199.0
523,Momisy Women's Cotton Lightly Padded Wire Free Maternity Bra,3.7,67.0,399.0,599.0
524,Hopscotch Boys Formal Set,3.8,383.0,699.0,1299.0
525,"Sunuo Baby's Cotton Cloth Diapers/Langot Washable and Reusable Nappies (Multicolour, 0-6 Months) Pack of 10 Pieces (W P)",3.9,5361.0,299.0,799.0
526,CLAP Baby Girl's Midi Dress (Pack of 4),4.4,888.0,749.0,1580.0
527,"VIC Kid® Bed Rail Guard for Baby/Kids Safety, 178cm x 90cm, Portable & Foldable, Baby Safety Essential, Adjustable Height...",4.4,477.0,1599.0,6499.0
528,GOCHIKKO Cotton Nursing Cover | Feeding Shawl | for Women & Mothers (Grey),4.0,194.0,479.0,899.0
529,EIO® 100% Cotton Rompers/Sleepsuits/Jumpsuit/Night Suits for Newborn Baby Boys & Girls Pack of 3,4.0,4382.0,599.0,1499.0
530,MA Baby Boys and Baby Girls Printed Cotton Baby Bodysuits Onesie one Piece Romper t Shirt for New Born Infant Toddlers Bab...,4.3,411.0,749.0,2500.0
531,a baby cherry - Suction Plates for Baby & Toddler - 100% Food Grade Plates for Kids - BPA Free - Divided Plates for Self F...,3.9,61.0,749.0,1999.0
532,"BRANDONN New Born Baby Single Blanket Swaddle Wrapper Blanket for Babies Cum Baby Sleeping Bag(Grey,Pack of 1)",4.1,1615.0,289.0,999.0
533,INFANTSO Baby Rocker Portable With  Mosquito & U- Shape Baby Pillow With Calming Vibrations with Music & Musical Toy BLUE,4.2,3534.0,3969.0,6750.0
534,Trendy Baby Boys & Baby Girls Shorts (Pack of 10),4.0,106.0,549.0,1500.0
535,"Sanskruti Hub Baby Proofing Corner Safety Strip and Corner Guard, Table Corner Protector for Baby Proofing Cushion Edge Pr...",3.8,15.0,249.0,999.0
536,Funkey Battle top Starter B187 Savior Valtryek Ev. Sh-7 top Toys Set with SL Launcher,2.6,7.0,699.0,1999.0
537,"Amazon Brand - Jam & Honey Rabbit Soft Toy (30 Cm, Pink)",3.9,120.0,349.0,1350.0
538,Goyal's Luv Mee Musical Activity Walker - Orange,3.9,2964.0,1199.0,1680.0
539,EIO Unisex Kids Cotton Pajama Pants Pack of 6,3.8,2362.0,499.0,1499.0
540,BabyGo 100% Cotton Frock for Baby Girl/Summer Clothes/Dress for Baby Girl/New Born/infent wear/for Baby Girls Pack of 2 Piece,4.3,654.0,474.0,1299.0
541,Wowper Fresh Baby Diaper Pants | Extra Large Size Diapers | Diapers with Wetness Indicator | Upto 10 Hrs Absorption | 14-1...,3.7,3383.0,1094.0,1797.0
542,EIO Baby Gifts Set for New Born Unisex Clothing Gift Hamper 6Pcs (Yellow),4.0,145.0,299.0,499.0
543,superbottoms Top & Shorts set | Tshirt with shorts | Evrydaywear™| Boys clothes | Girls clothes | Unisex | Cotton set comb...,4.2,139.0,229.0,449.0
544,"Mee Mee Soft Cushioned Potty Seat with Support Handles (Regular, Blue)",4.3,400.0,599.0,699.0
545,"HARISTAR Potty Trainer Seat Baby Potty Seat with Lid for Child Baby For-1,2,3,4 Year Babies, Suitable for Boy/Girl",3.7,135.0,299.0,499.0
546,"Mee Mee Ultra Thin Super Absorbent Disposable Nursing/Maternity | Breast Feeding/Breast Pads (White,12 Pads) |Leak Proof C...",4.3,152.0,125.0,129.0
547,"EcoSoft Plastic Sheet,PVC Sheet for Kids,Rubber Sheet for Babies,Bed Wetting Protector(36 x 40 Inches) (Rubber Sheet)",4.8,6.0,250.0,499.0
548,Himalaya Gentle Baby Soap 125GM,4.4,34188.0,54.9,75.0
549,Fareto Born Baby Double Layer 12 Cotton Nappies/Tying Langots/Cloths Nappies(Assorted)(Double Layer Cotton) (0-3 Months),3.9,768.0,360.0,699.0
550,Munchkin 7oz Miracle 360° Trainer Sippy Cup - Green (Pack of 1),4.3,7115.0,669.0,799.0
551,"StickMe 'Alphabets for Kids Learning Education Nursery Pre School Kinder Garden Baby Wall Sticker' -SM656 (Multi Colour, V...",4.3,100.0,349.0,899.0
552,"VRITRAZ Printed Character Little Baseball Cap for Kids, Baby Girls and Boys 3-12 Years",3.7,411.0,250.0,499.0
553,Aquaphor Advanced Therapy Baby Healing Ointment 14 Ounces (396 G),4.6,164.0,3499.0,3999.0
554,Goyal's Cartoon Baby Adjustable Walker - Music & Rattles with Parental Handle (Red),3.8,2585.0,1599.0,2499.0
555,Generic Maroon Bow with Cotton Cloth Turban Kont Bow Cap for Baby Girls & Baby Boys Turban Bow Cap Infant Head Cap,3.4,12.0,199.0,699.0
556,"Shyamcollections Baby Boy and Baby Girl's Fabulous Collection of Printed Full Sleeves Soft Hosiery Cotton Vests,Jhabla T-S...",3.8,548.0,499.0,1199.0
557,AHC Maternity Nursing Feeding Breast Pad Reusable Washable Comfortable Light Weight (2x2 Pack),4.3,17.0,210.0,500.0
558,Fomti Women's Hosiery Cotton Nighty/Night Dress/Gown in Maternity Wear Printed Maxi,4.3,7.0,399.0,1299.0
559,Funkey Battle Layer DB Launcher Suitable for All Spinning top Toys LR Launcher,2.9,45.0,399.0,1299.0
560,Dermadew Baby Cream(240 g)-Pack of 3,4.4,413.0,429.0,510.0
561,"Amazon Brand - Solimo Baby Water Resistant Dry Sheet, Medium, 100cm x 70cm, Navy Blue",4.1,6723.0,190.6,449.0
562,"M Cart DIY Building Blocks for Kids Building Blocks Toy for Kids Puzzle Games for Kids, Toys for Children Educational & Le...",4.0,22.0,897.0,1999.0
563,"SNOWIE SOFT® Sleeved Bib Baby Bib with Pocket, Toddler Bib, Smock, Waterproof Fabric, Fits Bibs for Baby Girls 6 to 24 Mon...",4.2,165.0,489.0,713.0
564,CEE 18 Women's Cotton Rayon A-Line Printed Stylish and Comfortable Pre and Post Maternity Kurti | Motherhood Maternity Fee...,3.9,3063.0,549.0,1999.0
565,CEE 18 Women's Cotton A Line Kurta,3.8,3925.0,799.0,2499.0
566,"Amazon Brand - Solimo Sherpa Fleece New Born Baby Blankets, Set of 2 (Navy Blue, Oat Milk)",4.6,3.0,459.0,849.0
567,"Rustic Art Amala Shikakai Organic Shampoo Bar | Methi, Ginger, Mango Butter | Reduces hair fall, detangles | 75 Gm",4.2,157.0,360.0,380.0
568,THE LITTLE LOOKERS Soft Plush Stretchable Baby Feeding Bottle Cover with Easy to Hold Strap | Cute Animated Overall Print ...,3.9,26.0,211.0,399.0
569,"Kassy Pop Baby Muslin Cotton Bath Towel - Also Usable as a Baby Blanket/ Swaddler, 105 X 105 cm",4.2,344.0,849.0,999.0
570,"Dancing Cactus,Talking Cactus Toy,Sunny The Cactus Repeats What You Say,Electronic Dancing Cactus Toy with Lighting,Singin...",3.8,26.0,403.0,1999.0
571,"El Regalo 2 PCs Swim Cap Kids/ Toddlers, Comfortable Breathable Polyester Fabric Swimming Caps Cute Cartoon Dolphin, Shar...",3.8,16.0,550.0,999.0
572,"Silakiva Women's Maternity Dress, Side Zipper Dress for Pregnant Ladies, Women Breast Feeding Dress for Nursing Pre and Po...",4.1,7.0,689.0,2199.0
573,"Zollyss Portable Baby Toilet Seat Foldable Western Kids Potty Trainer Cover for Toddler Boys Girls Travel, Blue (Plastic)",4.2,57.0,549.0,899.0
574,Nonibud Baby Waterproof Plastic Sheet Double Bed/Baby-Adult Waterproof Protection Sheet for Mattress (7.5 feet x 6.5 feet)...,3.8,203.0,399.0,799.0
575,ANKIMA Baby Baby Fruit Feeder Pacifier 2 Pack-Fresh Food Feeder-Silicone Nipple Teething Toy-Silicone Pouches for Toddlers...,5.0,7.0,199.0,400.0
576,"BeyBee Baby Bed Protector Waterproof Dry Sheet for New Born Babies (Large (140cm X 100cm), Yellow)",4.2,262.0,402.0,599.0
577,"Mee Mee Premium Baby Feeding Bottle (125 ml, Pink & Light Green)",4.1,326.0,258.0,400.0
578,Tilismi Moti For Teething Babies By REBUY,3.8,185.0,169.0,320.0
579,Nagar International Baby Bassinet & Cradle Bedding Set in Large Size Mosquito Net for 0-24 Months (Blue (0-24 Months)),4.0,257.0,1398.0,2950.0
580,BeyBee Waterproof Quick Dry Sheet for Baby| Bed Pad Anti-Piling Fleece Extra Absorbent Washable Matress Protector| Baby Be...,4.3,39814.0,849.0,1395.0
581,Toddylon Baby Bedding for New Born Mosquito Net Bed Sleeping Bag & Reversible Baby Nest Tub Bed (0-6 Months) (Pink),3.9,1183.0,899.0,2249.0
582,"Chicco Toothpaste Apple-Banana 50ml, Pack of 2 (100ml total)",4.5,131.0,290.0,358.0
583,CEE 18 Women's Cotton A Line Kurta,3.8,3925.0,799.0,1999.0
584,Bold N Elegant - Be Bold Inside & Elegant Outside Kid's Cotton T-Shirt,3.9,4050.0,549.0,1999.0
585,"Haus and Kinder Newborn Nursing Feeding Pillow, Breastfeeding Pillows with Removable Cover, Infant Support for Baby and Mo...",4.2,106.0,1049.0,2599.0
586,ARDAKI Baby Proofing Edge & Corner Guards Corner Protector Child Safety Edge Guards Pre-Taped Self Adhesive for Furniture ...,5.0,3.0,99.0,999.0
587,R for Rabbit i Bot Sterilizer with Dryer 2-in-1 Sterilizer Turns Dryer Electric Baby Milk Bottles Water Heater (White),4.2,208.0,3397.0,6795.0
588,SuperBottoms Dry Feel Langot - Pack of 12- Organic Cotton Padded Baby Nappy / Langot with Gentle Elastics & a SuperDryFeel...,4.2,638.0,1529.0,1920.0
589,"HRK Blocks Set for Kids, Play Fun and Learning Blocks for Kids Games for Children Block Game Puzzles Set Boys, Children (M...",3.4,190.0,199.0,799.0
590,SNOWIE SOFT ® Baby Safety Walking Harness; Child Toddler Anti-Lost Belt Harness Reins with Leash Kids Assistant Strap Ange...,3.9,203.0,599.0,801.0
591,"LOVEY DOVEY Soft Toys Long Soft Lovable hugable Cute Giant Life Size (Pig Set, 4pcs)",3.4,289.0,499.0,899.0
592,x2o Kids Cotton Pajama Pants with All Over Print and Bright Colors (Multicolor) (Pack of 5),4.0,1760.0,475.0,2999.0
593,ARVESA Monthly Birthday Milestone Special Unisex Baby Romper Onesies Dress Half Sleeve Envelope Neck,3.8,26.0,349.0,599.0
594,"Mommypure Dewy Love Natural Baby Face Cream With Cocoa Butter For Deep Moisturisation | Clean, Natural & Nourishing Protec...",4.1,260.0,349.0,449.0
595,NUEVOSKIDDOS Kids Girls Cotton Floral Printed Sun Hat | Bucket Style Hat | Round Hat | Summer Sun Hat | Beach Wear Garden ...,4.0,11.0,296.0,1499.0
596,Jikonet Women's Maternity Kurti for Feeding Zippers (VJK),5.0,3.0,499.0,999.0
597,Lifezen Inostretch Stretch Mark Cream To Reduce Stretch Marks & Scars Paraben Free & Dermatologist Approved (60-Gm) Pack Of 1,3.6,36.0,798.0,890.0
598,Jimmy Jammy Baby Boy & Girl Dress Soft Hosiery Cotton Blend T-shirt and Shorts Pack 4 T-shirt + 4 Shorts Multi colored,3.4,454.0,429.0,1299.0
599,Fresfoot Organic Cotton Socks For New Born Baby 0-18 Months - Multicolour,4.1,356.0,298.0,1699.0
600,"Mamaearth Hot Towel Anti Hair Fall Care Range, for Hair Fall Control, (Hair Mask 200ml + Shampoo 250ml + Conditioner 250ml)",3.9,792.0,1140.0,1297.0
