,name,ratings,no_of_ratings,discount_price,actual_price
205,"Superbottoms BASIC Quick Dry Pads | Insert | Diaper liner for Adjustable Cloth Diaper,Washable & Reusable Cloth Diapers(Co...",3.8,1118.0,379.0,750.0
206,"Baby Nail File Electric Nail Trimmer Manicure Set with Nail Clippers, Toes Fingernails Care Trim Polish Grooming Kit Safe ...",4.5,9170.0,449.0,999.0
207,"BeeBaby Teddy Teethers for 6 to 12 Months BPA Free. Cooling Water Filled Baby Teether, Soft Teething Toy for Babies with C...",4.0,4.0,96.9,149.0
208,"LuvLap Instadry Anti-Piling Fleece Extra Absorbent Quick Dry Sheet for baby, Baby Bed Protector, Waterproof baby sheet, Sm...",4.1,6205.0,139.0,179.0
209,"Pampers Premium Care Pants, Extra Large size baby Diapers, (XL) 24 Count Softest ever Pampers Pants,",4.6,1012.0,704.0,849.0
210,"BeyBee Extra Absorbent Quick Dry Sheet for Baby, Baby Bed Protector, Waterproof Baby Sheet (Large - 140cm X 100cm, Dark Blue)",4.3,39814.0,425.0,599.0
211,LILTOES Premium Baby Safety Helmet (Spaceship),4.2,67.0,569.0,1499.0
212,"HUG 'n' FEEL SOFT TOYS Teddy Bear, Soft Toys, Teddy Bear 3 feet for Girls, Birthday Gift for Girls, Birthday Gift, Boyfrie...",4.1,28065.0,758.0,1999.0
213,"Mee Mee BPA Free, 2 in 1 Convertible Sipper Cup for Babies/Toddlers/Kids with Soft Spout & Straw/Anti-Leak/Detachable Hand...",4.0,2700.0,242.0,349.0
214,"HUG 'n' FEEL SOFT TOYS Panda Teddy, Panda 3 Feet, Soft Toys, Teddy Bear 3 Feet for Girls, Soft Toys for Kids, Birthday Gif...",4.1,28065.0,720.0,999.0
215,Khasala Brothers® Jhoomer Merry Go Round Hanging Toy for New Born Baby with Rattles Soothing Sound for Kids ( Multicolor ),4.5,78.0,178.0,999.0
216,Ratna's Junior Smiley Ring Stacking & Sorting Multicoloured 5 Rings for Infants & Toddlers to Learn Colour & Size,4.1,13093.0,112.0,150.0
217,Solasz 100% Spanish Baby Massage Pure Olive Oil 500ml,4.2,952.0,436.0,895.0
218,R for Rabbit XS New born Premium Feather Diaper nb Taped Size for Baby 0 to 5 kgs (66 Combo Pack Offer),4.2,2388.0,989.0,1485.0
219,Baby Bucket Baby Diaper Nappy Changing Baby Diaper Bag Mummy Bag Handbag-(Pack of 4 – Navy Blue-1),4.2,1181.0,895.0,1350.0
220,Supples Baby Diaper Pants M Pack of 3 Super Jumbo Box (216 Piece),4.0,127863.0,1829.0,3147.0
221,"SNOWIE SOFT® Cloth Books for Babies, 6pcs Nontoxic Fabric Soft, Early Education Toys, Waterproof Soft Books for Toddler, I...",4.0,415.0,791.0,1122.0
222,Boniry pop it Fidget Toys Toy Set Rainbow poppit Push 100 Bubble for Kids Stress Relief Adults Anxiety Simple Popper Shape...,4.1,1706.0,199.0,999.0
223,Philips Avent Natural Teat One Slot Variable Flow - 3months+ (2Pc. Pack),4.4,8627.0,232.0,275.0
224,"BeeBaby Orthodontic Silicone Baby Pacifier with Protective Cap, Pink (Pack of 2)",3.7,425.0,177.0,229.0
225,Bold N Elegant - Be Bold Inside & Elegant Outside Baby's Cotton Tshirt Pant Set,4.2,4698.0,639.0,2499.0
226,"Wakefit Pregnancy Pillows for Sleeping | 3 Month Warranty | Pregnancy Pillow, Maternity Pillow, Pregnancy Pillow for Pregn...",4.4,40.0,1348.0,1999.0
227,"Little Angel Extra Dry Baby Pants Diaper, Small (S) Size, 44 Count, Super Absorbent Core Up to 12 Hrs. Protection, Soft El...",4.0,46531.0,362.0,575.0
228,Party Propz POPIT UP Games- 6 Pcs Wrist Band Pop It Rainbow Pop Fidget Toys Poppet Push Pop Bubble Fidget Popping Sensory ...,4.4,31.0,379.0,599.0
229,BabyGo 100% Cotton Frock for Baby Girl/Summer Clothes/Dress for Baby Girl/New Born/infent wear/for Baby Girls Pack of 2 Piece,4.3,654.0,474.0,1299.0
230,Babymoon Headbands Flowers Soft Cotton Hairbands for Baby Girls Infants Toddlers,4.0,113.0,199.0,345.0
231,"Mylo Essentials Baby Carrier Bag for 6 Months-15 Months Baby - Lightweight, Ergonomic, 3 in 1 Front, Back & Head Support K...",3.6,1087.0,757.0,1199.0
232,HomeFast Comfortable Squat Stool for Western Toilet Portable Sturdy Foot Step Stool for Potty Training Kids Adults - Made ...,4.1,462.0,699.0,1699.0
233,"Luv Lap Baby Diaper Pants XL Size (Extra Large) , with Aloe Vera Lotion for rash protection, Pack of 162 Count (54x3), wit...",4.0,12797.0,2379.0,2997.0
234,Prime Deals Monkey Heavy Plastic Ball Drop Toy for Babies and Toddlers | New 5 Layer Tower Run with Swirling Ramps and 3 P...,4.5,936.0,498.0,999.0
235,House of Quirk Baby Diaper Bag Maternity Backpack,4.4,319.0,1199.0,1499.0
236,Mirada Coral Cute Plush Huggable Bunny Stuffed Soft Toy - 35 cm(Coral),4.5,1449.0,764.0,899.0
237,"Mamaearth Anti Dandruff Conditioner, With Tea Tree & Ginger Oil, For Dandruff Free Hair 250ml",4.0,932.0,324.0,349.0
238,Baby Bucket Baby Diaper Nappy Changing Baby Diaper Bag Mummy Bag Handbag-(Pack of 4 – Navy Blue),4.3,1723.0,895.0,1350.0
239,OYO BABY Extra Virgin olive oil for baby massage 200ml,4.3,372.0,219.0,280.0
240,"Storio Beach Sand Toys Castle Play Set with Fish, Crab Moulds for Kids & Toddlers, Useful for Gardening & Outdoor Tool Kit...",4.8,72.0,259.0,325.0
241,"Prime Deals Dancing Dog with Music, Flashing Lights - Sound & Light Toys for Small Babies | Best Gift for Toddlers",4.1,64.0,398.0,999.0
242,Qubo Baby Cam from Hero Group Baby Monitor 2MP Wi-Fi 1080p Full HD Baby Cry Alert Sleep Monitor Audio & Video Monitor | Mo...,4.0,422.0,3990.0,7490.0
243,Googo Gaaga Boy's T-Shirt,3.9,326.0,499.0,1400.0
244,"R for Rabbit Premium Chocolate Ride Stylish Baby Stroller and Pram for Baby, Kids, Infants, Newborn, Boys & Girls of 0 to ...",4.4,800.0,8798.0,10999.0
245,"Huggies Complete Comfort Dry Pants Extra Large (15-25kg) Size Baby Diaper Pants, 13 count, with 5 in 1 Comfort",4.0,30295.0,219.0,220.0
246,"LuvLap wipes for baby skinParaben Free, Fragrance Free, pH Balanced, Dermatologically Safe, Baby Wipes for Sensitive skin,...",4.2,676.0,205.0,297.0
247,TERI BERI Muslin Cotton Face Towels for Newborn Baby Extra Soft Hankies Reusable Napkins for Infants Toddlers (Pack of 5) ...,4.3,44.0,399.0,800.0
248,"Dabur Baby Super Pants |Large Size Baby Diapers | Natural Skin Protection | Infused with Aloe Vera, Shea Butter & Vitamin ...",4.0,2097.0,329.0,549.0
249,"LuvLap 4 Stage Baby Oral Care Set for infant, baby, Toddler & Kids' primary teeth & gums, Infant Gum Massager, 2 Toddler b...",3.9,139.0,247.0,299.0
250,R for Rabbit Hiltop Step Stool Potty-Trainer Seat Ladder Step Up Training Stool Non-Slip Steps Ladder Adjustable Foldable ...,4.3,21.0,1353.0,1692.0
251,Mee Mee Bundle of Joy Gift Set for New Born Baby with Baby Bathing kit and Wet Wipes,4.6,49.0,233.0,299.0
252,SmartoKids Activity Box for 2 to 3 Year Old Baby Boys & Girls (11-in-1 Set) – Learning & Educational Gift Pack of Play-Bas...,4.2,451.0,740.0,1299.0
253,EIO Boys and Girls Cotton Pajama Pants Pack of 6,3.8,2621.0,499.0,1499.0
254,KidDough Baby Proofing Finger Pinch Door Guard for Kids | Slamming Door Protection for Child Safety | (Pack of 3) Door Cra...,4.0,495.0,549.0,899.0
255,"LuvLap Soft 100% Cotton Hooded Wrapper Cum Warm, Blanket, for New Born Baby to 3 Year Old, 75cmx75cm, Elephant Print (Pink)",4.1,470.0,249.0,345.0
256,TechHark® Die-cast Model Sound and Light Pull Back Cars Toys,4.3,516.0,899.0,1699.0
257,StarAndDaisy Baby Potty Training Seat | Toddler Toilet Pot | Toilet Training chair for Kids | Toddlers-Comfortable Safe cu...,4.4,97.0,749.0,999.0
258,"Besties Cotton Toddlers Training Seat Baby Safety Sofa Dining Chair/Learn to Sit Stool, 3-12 Months (Car Shape Sofa Blue)",3.6,369.0,899.0,1999.0
259,SYGA Kid's Cotton Beanie Cap With Big Bow,4.1,482.0,199.0,699.0
260,"A to Z Hub Baby Cradle N Swing Ghodiyu with Indian Style Hammock Having Mosquito Net for New Born Infants,Blue",4.1,752.0,2699.0,3500.0
261,"Summer Stories Visual Stimulation Cards for Newborns and Infants, High Contrast Flash Cards for Babies 0-6 Months 6-12 Mon...",4.2,27.0,599.0,1199.0
262,BEAU STUTI Battling Top DB Layer System B-193 Booster Bey Ultimate Valkyria .Lg.V'-9 Set with lr String Launcher Right-Spi...,3.3,30.0,699.0,1999.0
263,Himalaya Baby Massage Oil (Coconut) 100 ml,4.3,623.0,84.0,125.0
264,Wowper Fresh Baby Diaper Pants | Small Size Diapers | Diapers with Wetness Indicator | Upto 10 Hrs Absorption | 4-8 Kg | 5...,3.7,3383.0,393.0,599.0
265,SuperBottoms NEW UNO Freesize Cloth Diaper | Cloth diaper for babies 3M to 3Y | Washable & Reusable cloth diaper | Comes w...,3.8,2185.0,659.0,890.0
266,"TONY STARK BIG SIZE Foldable Baby Mosquito Net, Bottomless Net for Infants, for Safe & Easy Use | Ensures Your Baby's Safe...",4.2,53.0,749.0,1099.0
267,NammaBaby Cotton Pajama Pants with All Over Print for Boys and Girls (Multicolor Designs)(Regular Fit)(Pack of 5),4.0,13156.0,699.0,1999.0
268,"Mee Mee Soft Baby Knee/Elbow Pads for crawling, Anti-slip padded stretchable elastic, Breathable cotton comfortable (Singl...",3.8,1650.0,167.0,199.0
269,NEW COMERS® Milestone Blanket and Props for Baby's Monthly Photoshoot|1 to 12 Month Cards|Multiuse Products|Ac Room Blanke...,4.0,49.0,699.0,1499.0
270,"Mee Mee Advanced Digital Electric Breast Pump with 3 Modes - Massage, Suction & Let-Down |For Nursing & Breastfeeding (White)",3.6,23.0,2135.0,2999.0
271,Superbottoms BASIC EASY - Pack of 8 |4 Cloth Diapers+ 4 Inserts - Freesize Adjustable & Reusable Cloth Diaper for babies ...,3.8,8763.0,1239.0,2996.0
272,MY ARMOR U Shaped Pregnancy Pillow for Sleeping | 6 Month Warranty | Full Body Pregnancy Pillows for Pregnant Women with W...,4.4,522.0,2199.0,3999.0
273,minicult Cotton Pajama Pants with All Over Print for Boys and Girls (Multicolor Designs)(Regular Fit)(Pack of 5),4.0,26549.0,499.0,2999.0
274,"Mylo Care Baby Diaper Pants Extra Large (XL) Size, 12-17 kgs with ADL Technology - 56 Count - 12 Hours Protection",3.9,991.0,729.0,998.0
275,"SafeMyles Foldable Baby Mosquito Net, Bottomless Net for Baby, for Safe & Easy Use | Ensures Your Baby's Safe Sleep - Upto...",4.5,644.0,899.0,1050.0
276,Curatio Baby Spoo Shampoo 125ml,4.4,264.0,240.0,275.0
277,"Mee Mee Mild Baby Liquid Laundry Detergent (Bottle) (300 ml, Bottle)",4.4,409.0,232.0,279.0
278,Morisons* babydreams THE CHOICE OF SMART MUMS Baby Dreams Bottle & Accessories Cleaner 500ml,4.5,856.0,339.0,399.0
279,First Kick New Born Baby Soft Neck Supporting Pillow for Head Shaping Baby (0-18 Month) Beige,3.9,298.0,236.55,799.0
280,"Sunuo Washable Reusable Multicolour Hosiery Cotton Diapers,Nappy,Langot for New Born Baby (0-6 Months,Pack of 10)",3.9,2180.0,299.0,499.0
281,"The Purple Tree Moon and Star Cushion Baby Photo Shoot Prop Accessories (Pack of 1 Moon and 5 Star, Grey) Cute Props for B...",4.0,758.0,599.0,1299.0
282,StarAndDaisy Folding Baby High Chair Recline Highchair Height Adjustable Feeding Seat Wheels *Upgraded Version with Wheel ...,4.0,930.0,3999.0,8999.0
283,YBN Peppa Pig Heavy Quality Games Theme Stainless Steel Baby Feed Spoon and Fork Set- Multi Color,4.2,77.0,159.0,399.0
284,"BabyChakra Baby Sunscreen, SPF 30+ PA+++ UVA/UVB Protection Non-Sticky & Water-Resistant, Toxin Free Dermatologically Test...",4.1,12.0,241.0,350.0
285,"Mee Mee Soft Baby Knee/Elbow Pads for crawling, Anti-slip padded stretchable elastic, Breathable cotton comfortable (Singl...",3.8,1650.0,181.0,199.0
286,MY NEWBORN Baby Bath Towel Robe Hooded Blanket Wrapper -White-Panda,4.0,1596.0,269.0,900.0
287,"Toys N Smile Metal Bey Blade Toy Pack with Ripchord Launcher 4 Bey Blade, Multi Color(Pack of 1 set)",3.6,331.0,495.0,499.0
288,"Chicco Baby Moments Diaper Rash Cream, New Advanced Triple Protection Skin Shield Formula with Natural Ingredients to Prev...",4.2,49.0,170.0,189.0
289,BabyGo 100% Cotton Frock for Baby Girl/Summer Clothes/Dress for Baby Girl/New Born/infent wear/for Baby Girls Pack of 2 Piece,4.3,654.0,474.0,1299.0
290,R for Rabbit Large L Size Premium Feather Diaper for Baby 9 to 14 kgs (140 Combo Pack Offer),4.2,2388.0,2498.0,3852.0
291,"Lifree Medium Size Diaper Pants EXTRA ABSORB EASY SELF WEAR HIGH ABSORBING - For Men and Women,10 Count",4.3,2115.0,335.0,520.0
292,"3 Piece Baby Bow Cap -Turban Bow Cap Baby Bow Cap -Turban Bow Cap,Baby Cap, Turban Cap, Baby Headwear Suitable for 0 to 12...",3.3,15.0,310.0,799.0
293,"Mylo Essentials Premium 3 in 1 Comfortable & Adjustable Newborn Baby Carrier Backpack with Padded Shoulder Strap, Sturdy B...",3.6,117.0,1399.0,1899.0
294,"BeyBee Waterproof Rubber Sheet (Small (50cm X 70cm), Grey)",4.3,39814.0,167.0,199.0
295,Mee Mee Baby Talcum Powder |Dermatologically tested | Gentle for Newborns | Anti - rash | Paraben free | 0m+ (Fresh Feel -...,4.3,967.0,450.0,598.0
296,Antson 8 Pcs Edge Protector for Furniture Table Corner Guards for Sharp Edges Silicon Corner Protector for Sharp Edges Gel...,4.5,117.0,249.0,699.0
297,"Little Angel Extra Dry Baby Pants Diaper, Medium (M) Size, 148 Count, Super Absorbent Core Up to 12 Hrs. Protection, Soft ...",4.0,46531.0,1190.0,2198.0
298,"Softsens Baby Gentle Cloth Wipes with Aloe & Vitamin E, with Lid, 72 wipes (Pack of 3)",4.3,76.0,276.0,690.0
299,"18 Pack Pop It Pop Its Rainbow Pop Fidget Toys Poppet Push Pop Bubble Fidget Popping Sensory Toy for Kids and Adults, Fidg...",4.0,137.0,595.0,999.0
300,"Toyshine Stunt Tricyle Toy Lights and Sound Electric Car Model Toy Vehicles Toys for Toddlers Baby Kids Children Birthday,...",4.4,830.0,854.0,1499.0
301,"Pampers Taped Diapers, Large (LG), 18 count for Kids",4.3,13689.0,340.0,379.0
302,BABBY NEST Baby ON Board (Bottle),3.9,25.0,183.0,249.0
303,PATPAT® 3 PCS Suction Cup Toys for Baby 6 - 24 Months Cartoon Pop It Top Toy Bath Toys Suction Cup Design for Baby Dining ...,3.9,51.0,791.0,1122.0
304,"AH Decals Cartoon Animated Lion Elephant and 3D Butterflies Wall Sticker for Kids for Living Bed, Vinyl",4.3,16.0,325.0,999.0
305,"Mamaearth Rice Hair Oil with Rice Bran & Coconut Oil For Damaged, Dry and Frizzy Hair 150ml",4.0,763.0,370.0,419.0
306,"OYO BABY Baby Diaper Pants XL Size (Extra Large), with Aloe Vera Lotion for rash protection, Pack of 36 Count, with upto 1...",4.3,97.0,421.67,649.0
307,"Fun Ride Baby Walker 6 to 18 Months - Herby Foldable Activity Walker with Adjustable Height for Boys and Girls, 1 Qty, Gre...",3.7,326.0,1549.0,2225.0
308,"Luvlap Soft Silicon Inverted Nipple Puller for Breastfeeding, BPA Free,White, Non Toxic",3.1,325.0,114.0,199.0
309,"SYGA Foldable Baby Bottle Drying Racks Feeding Cup Nipple Storage Shelf Stand Holder (Pink), 1 Piece",4.4,286.0,190.0,550.0
310,"CalMyotis Corner Protector, Baby Proofing Table Corner Guards, Keep Child Safe, Protectors for Furniture Against Sharp Cor...",4.2,5541.0,316.0,499.0
311,LENAM Baby Cotton Soft Pants/Diaper Fit/Pyjama/Leggings(Pack of 7),4.2,262.0,499.0,2000.0
312,Luke and Lilly Baby-Girl's Regular Fit Dress,3.9,267.0,449.0,1299.0
313,"Philips Avent Ultra Air Pacifier for Girl, 6-18 Months, Pink Fashion Decos, 2 Pack, SCF343/22",4.2,2495.0,385.0,455.0
314,"LOVEY DOVEY Kangaroo Soft Toy, Baby Toys, Kids Toy, Soft Toy, Toy for Girl, Birthday Gift for Girl/Boys, Toy Gift for Girl...",4.0,204.0,399.0,799.0
315,MamyPoko Pants Extra Absorb XXL28,0.0,0.0,574.56,799.0
316,"HEGZI Feeding Pillow, Breast Feeding Pillows with Removable Cover, Vacuum Packed, Cotton Nursing Pillow and Positioner, Br...",4.1,195.0,999.0,4999.0
317,Aphrodite Magic Lattoo Spinning Top Toy with LED Flashing Colorful Lights Laser Toy Spinner Toy Stress Relief Gadgets Non ...,4.1,33.0,349.0,999.0
318,Toyzone Building Blocks | Building Blocks Game | Educational Toy | Smart Activity Fun & Learning Blocks | Colorful Blocks...,4.2,1459.0,450.0,599.0
319,"Himalaya Herbals Natural Moisturizing Lip Butter, 10gm",4.1,1853.0,131.0,160.0
320,"MamyPoko Diaper pants, New born, Pack of 8",4.3,2054.0,84.0,99.0
321,"Mee Mee Multipurpose Diaper Bags, Stylish Waterproof Travel Backpack Mom/Mamas Bags/Diapers Bags for New Born Baby",4.2,115.0,572.0,1626.0
322,Infantbond Combo of Baby Bed with Net | Carry Bag | 4 Pcs Bedding Set(0-6 Months) (Lemon Yellow),4.1,149.0,850.0,1999.0
323,PLAY TOOL 50 Baby Air Multi Colour Balls - Fifty Piece of 5.8 cm Size Ball for Kids - Indoor & Outdoor Activities and Exce...,3.5,65.0,299.0,699.0
324,"PRIME DEALS Mix Cute Animals Swimming Water Toys Non-Toxic,BPA Free Colorful Soft Rubber Float Squeeze Sound Squeaky Bathi...",4.0,346.0,298.0,899.0
325,1st Step BPA Free Straw Sipper Cup with Twin Handle (Pink),4.1,111.0,171.0,229.0
326,"Pigeon Baby Skincare Wipes,PH Balance,Paraben Free,Alcohol Free,Sulphate Free,Non-Irritant,Enriched with Glycerin,72 Sheet...",4.2,1664.0,155.0,198.0
327,"Decals Design 'You are My Sunshine Rainbow' Wall Sticker (PVC Vinyl, 70 cm x 50 cm),Multicolor",4.2,367.0,129.0,664.0
328,haus & kinder 100% Muslin Cotton Swaddle Wrap for New Born Baby - Pack of 5 (Blue),4.6,1191.0,1049.0,2499.0
329,"SAFE-O-KID - 2 Meter Bedrail, Plain Washable Bed Rails Full Bed Size, (6.5 ft/ 78 inches/199 cms/x 2.1 ft/ 25 inches/63 cm...",3.9,726.0,3299.0,6798.0
330,"HUG 'n' FEEL SOFT TOYS Mickey Mouse Stuffed Soft Toy for Kids (Multicolour, 26 cm) Lovely Toy Figure",4.1,428.0,472.0,899.0
331,"Chicco Fliptop Wipes (Pack of 3, 72 Count per Pack)",4.5,254.0,543.0,657.0
332,"Bodyguard Premium Natural Anti Mosquito Repellent Patches (Green, 48 Patches)",3.5,157.0,256.0,350.0
333,"Luv Lap LuvLap Baby Diaper Pants New Born Size (NB), with Aloe Vera Lotion for rash protection, Pack of 180 Count (60x3)up...",4.0,12797.0,1409.0,2007.0
334,"OYO BABY Baby Diaper Pants L Size (Large), with Aloe Vera Lotion for rash protection, Pack of 42 Count, with upto 12Hr pro...",4.3,97.0,430.42,649.0
335,"superbottoms Rai Mustard Seed Head Shaping Pillow for Newborn Baby, Refillable Pillow | 100% Cotton Cover, Customize Musta...",4.1,150.0,549.0,1099.0
336,"Ziory Kid's Acrylic Baseball Cap (Pack Of 1) (Blue, White)",4.0,201.0,399.0,449.0
337,"Papimo Baby Diaper Pants with Aloe Vera, Small (4 - 8 kg), 78 Count",3.8,25106.0,659.0,999.0
338,L'Oreal Paris Kids Tropical Mango Shampoo 250ml,4.3,234.0,415.0,650.0
339,"superbottoms BASIC Pack of 2 Diaper+2 Inserts, Combo Pack of Assorted Freesize Washable and reusable cloth diaper with dry...",3.8,4005.0,649.0,1498.0
340,minicult Cotton Pajama Pants with All Over Print for Boys and Girls (Multicolor Designs)(Regular Fit)(Pack of 5),4.0,26549.0,635.0,2999.0
341,"OYO BABY Baby Diaper Pants L Size (Large), with Aloe Vera Lotion for rash protection, Pack of 42 Count, with upto 12Hr pro...",4.3,97.0,430.42,649.0
342,"superbottoms Rai Mustard Seed Head Shaping Pillow for Newborn Baby, Refillable Pillow | 100% Cotton Cover, Customize Musta...",4.1,150.0,549.0,1099.0
343,"Ziory Kid's Acrylic Baseball Cap (Pack Of 1) (Blue, White)",4.0,201.0,399.0,449.0
344,"Papimo Baby Diaper Pants with Aloe Vera, Small (4 - 8 kg), 78 Count",3.8,25106.0,659.0,999.0
345,L'Oreal Paris Kids Tropical Mango Shampoo 250ml,4.3,234.0,415.0,650.0
346,"superbottoms BASIC Pack of 2 Diaper+2 Inserts, Combo Pack of Assorted Freesize Washable and reusable cloth diaper with dry...",3.8,4005.0,649.0,1498.0
347,minicult Cotton Pajama Pants with All Over Print for Boys and Girls (Multicolor Designs)(Regular Fit)(Pack of 5),4.0,26549.0,635.0,2999.0
348,"Softsens Baby Nourishing Bar Soap with Colloidal Oatmeal, Shea Butter & Vitamin E, 3 Soap x 100g",4.2,166.0,149.0,199.0
349,"LuvLap Baby Bed with Thick Mattress, Mosquito Net with Zip Closure & Neck Pillow, Baby Bedding for New Born, 3M+, Stars Pr...",4.1,1531.0,549.0,825.0
350,"Sathiyas 480 GSM 4 Piece Bath Non-Terry Cotton Towel Ultra Absorbent Super Soft and Comfortable-Quick Drying Towel (Blue, ...",4.0,5808.0,711.0,1498.0
351,"OYO BABY Baby Bed Protector Dry Sheet for New Born Babies (Large (140cm x 100cm), Grey)",4.3,11146.0,499.0,595.0
352,Haristar Potty Seat For Baby 1 to 6 Year Baby || Training seat For Small Baby || Cushion Seat || Griped Avilabel || (blue),4.0,233.0,295.0,599.0
353,Dhruvi Women's Printed Rayon Anarkali Maternity Dress with Zippers,3.7,297.0,649.0,1699.0
354,"Dr. Brown's Infant-to-Toddler Toothbrush, Giraffe",4.8,16497.0,534.0,549.0
355,Niren Enterprise Bullfinch Floral Printed Modal Baby Frock for Kids Dress,5.0,1.0,499.0,1999.0
356,Jikonet Women's Maternity Kurti for Feeding Zippers (VJK),5.0,3.0,499.0,999.0
357,cute Landings Kid's Cotton Cap (Multicolor_3 Months-6 Months),4.3,1104.0,319.0,499.0
358,Supples Baby Diaper Pants S(4-8kg) Super Jumbo Box (234 Piece) (78*Pack of 3),4.0,127863.0,1619.85,3147.0
359,"Giggles - Stack N Nest Toy , Multicolour 3 in 1 Gift Set, Develops Motor Skills , 6 Months & Above, Infant and Preschool Toys",4.4,857.0,449.0,599.0
360,Dabur Baby Wash: pH 5.5 balanced | No Harmful Chemicals & Tear Free Formula | With Ayurvedic herbs | Hypoallergenic & Derm...,4.2,3445.0,128.0,165.0
361,"Chicco Baby Moments Talcum Powder, New Advanced Formula with Natural Ingredients to Prevent Rashes & Irritation, Creates P...",4.0,53.0,91.0,99.0
362,"First Kick New Born Super Soft Baby Blanket Wrapper Sheet Cum Baby Blanket for Baby Boys, Baby Girls, Babies (100cm x 80c...",4.4,511.0,379.05,999.0
363,"Little One's | 6 Plastic Shelves Foldable Baby Storage Box (Made in India), Unbreakable Material, (Steel Structure)| Jungl...",4.3,11328.0,1549.0,2600.0
364,VGRASSP Unicorn Family Baby Spoon and Fork Cutlery for Babies and Kids - Stainless Steel (304) Tableware Set with Comforta...,4.5,250.0,299.0,999.0
365,"Funskool Games - Tambola 2 in 1 Game, A Complete Family Entertainment Game, Reusable Tickets, 2+ Players,for Kid 7 & Above",3.6,64.0,223.0,399.0
366,"VRITRAZ Cartoon Character Printed Little Cap for Kids, Baby Girls and Boys 3-12 Years",4.1,75.0,399.0,499.0
367,"My Newborn Baby Mittens Caps Gloves and Booty Combo Set - Pair of 4 (Assorted Colours, 0-3 Months) | Unisex Booty Set | Du...",3.9,1218.0,449.0,1200.0
368,"Himalaya Baby Powder, 400 g",4.5,39.0,201.0,235.0
369,Baby Collection Printed Baby Vest for Kids Cotton Sleeveless Sando Baniyan Toddler Innerwear Baby Cloth for Boys & Girls P...,4.3,105.0,529.0,899.0
370,Cetaphil Baby Wash & Shampoo with Organic Calendula - Pack of 2,4.5,75.0,2021.0,2350.0
371,Koparo Clean Natural Dishwashing Liquid | 5 Litres Pack | Fragrance - Liime And Basil | Eco-Friendly & Plant Based With Te...,4.2,432.0,1299.0,1999.0
372,"Baybee Wooden Hammer Case Toy Knock Pounding Bench for Kids, Developing Fine Motor and Dexterity Skills, Early Educational...",3.9,1503.0,399.0,599.0
373,"Bambo Nature Premium Baby Diapers - White, Large Size, 48 Count, for Toddler Baby - Super Absorbent, Eco-Friendly and with...",4.2,181.0,1911.0,2099.0
374,KidDough Furniture Safety Locks for Kids (4 Brown + 4 White Locks),4.0,603.0,415.0,550.0
375,Infantbond Combo of Baby Bed with Net | Carry Bag | 4 Pcs Bedding Set(0-6 Months) (Blue Fox),4.2,82.0,836.07,1999.0
376,Tendercare Baby boy & Baby Girl Cotton Rabbit Dungaree Set with Tshirt || Baby boy Dresses for 0-6 Months || Newborn Baby ...,4.0,769.0,329.0,599.0
377,"Chicco Baby Moments Gentle Body Wash And Shampoo with Natural ingredients, No tears, Soap free, Head to toe bath, Dermatol...",4.4,136.0,119.0,149.0
378,"Pigeon Apple Toothpaste, For babies and Children,Fluroide -free,SLS free,Color free,Paraben Free, PH friendly,45 g,Pack of 2",4.3,6018.0,270.0,330.0
379,Elk Baby Boys' & Baby Girls' T-Shirt (Pack of 6),4.1,1200.0,599.0,1999.0
380,"MamyPoko Extra Absorb Diaper pants, XXXL,Unisex Baby, Pack of 22",4.3,155343.0,979.0,1099.0
381,"Goyal's Hammer Ball Toys for Kids- Pounding Game Set for Baby Kids and Toddlers for Early Development, Best Toy for 1 Year...",5.0,1.0,549.0,1499.0
382,New Elite Women's Rayon Maternity Feeding Kurti with Zipper and Belt for preganant Women,4.1,44.0,699.0,2699.0
383,KOLOSSALZ Own The Excellence Galaxy Glow in Dark Kids Ceiling Acrylic Stickers || Kids b'day Gifts || Pack of 152 Stars ||...,4.1,2236.0,289.0,499.0
384,ROCKBURG India Baby Soft Cushioned Potty Training Seat | Back Support for Toddler Boys Girls | Kids Toilet seat for Wester...,3.6,27.0,307.0,799.0
385,Baby's Extra Care Pant Diapers (XXXL) 50 Count,3.2,119.0,679.0,999.0
386,FLIPZON Premium Baby Cushioned Potty Seat with Easy Grip Handles and Comfortable Seat / Toilet Seat with Handle for Kids /...,4.1,4998.0,375.0,649.0
387,StarAndDaisy Sunrise Baby Stroller and Pram with Extended Mosquito Net and Ultra Soft Cushions & Reversible Handlebar Stro...,4.0,182.0,3649.0,6999.0
388,LILTOES Baby Safety Helmet Baby Pink,4.1,183.0,475.0,1299.0
389,"LuvLap Adaptable 2 in 1 Potty Training Seat for 1 + Year child, potty trainer with Detachable Potty Bowl, Suitable for pot...",4.4,2439.0,871.0,1395.0
390,Mother Sparsh 98% Pure Water Wipes | Plant Based | pH Balanced | 60 Pcs (Pack of 1),4.4,5189.0,125.0,159.0
391,FWQPRA® Baby Bath Tub with Bath Stand Large Size Anti-Slip Bottom Non-Toxic Material Children Bathtub Bucket for Baby Bath...,4.6,76.0,1549.0,2999.0
392,Mamaearth Face Pack Cream with Neem and Tea Tree For Pimples and Zits (100 ml),4.0,1688.0,463.0,499.0
393,"Mee Mee BPA Free, 2 in 1 Convertible Sipper Cup for Babies, Toddlers, Kids with Soft Spout & Straw, Anti-Leak, Detachable ...",4.0,1446.0,237.0,329.0
394,"LuvLap Instadry Anti-Piling Fleece Extra Absorbent Quick Dry Sheet for baby, Baby Bed Protector, Waterproof baby sheet, Sm...",4.1,6205.0,139.0,179.0
395,Super Cute's Wonder Pullups Diaper Pants (XL) | Super Soft and Rash Free Diapers| Protection upto 12 hours with No Leakage...,3.2,44.0,299.0,399.0
396,NammaBaby Cotton Pajama Pants with All Over Print for Boys and Girls (Multicolor Designs)(Regular Fit)(Pack of 5),4.0,13156.0,699.0,1999.0
397,"SAFERSKY (Set Of 4 Pcs) Baby Knee Pads for Crawling, Anti-Slip Padded Stretchable Elastic Cotton Soft Breathable Comfortab...",4.5,20.0,479.0,1198.0
398,THE MODERN TREND The-Modern-Trend--Baby Head Protector Safety Head-0 to 3 Year Baby/Kid Helmet Yellow,3.8,12.0,287.0,1200.0
399,"Amazinghind Crib Mosquito Net for Cot, Crib & Cot Bed with Zipper Opening for Easy Access to Your Baby. Ideal for Large Cr...",3.8,22.0,474.0,899.0
400,"Bigbought New Born Baby Care Jabla (10 Pcs), Nappy (8 Pcs), Hand Mittens (4 Pair), Leg Booties (4 Pair) And Cap (4 Pcs), P...",3.8,67.0,725.0,1299.0
